18,100085,Communication Services,41000.0,"Baidu, Inc. provides internet search services primarily in China. Its Baidu Core segment offers products for users, including Baidu App to access search, feed, and other services using mobile devices; Baidu Search to access its search and other services; Baidu Feed that provides users with personalized timeline based on their demographics and interests; Haokan short video app; and Quanmin flash video app for users to create and share short videos. It also offers Baidu Knows, an online community where users can ask questions to other users; Baidu Wiki; Baidu Healthcare Wiki; Baidu Wenku; Baidu Scholar; Baidu Experience; Baidu Post, a social media platform; Baidu Maps, a voice-enabled mobile app that provides travel-related services; Baidu Drive; Baijiahao; and DuerOS, a smart assistant platform. In addition, this segment offers online marketing services, which include pay for performance, an auction-based services that allow customers to bid for priority placement of paid sponsored links and reach users who search for information related to their products or services; other marketing services that include display-based marketing services and other online marketing services based on performance criteria other than cost per click; mobile ecosystem, a portfolio of apps, including Baidu App, Haokan, and Baidu Post; various cloud services and solutions, such as platform as a service, software as a service, and infrastructure as a service; self-driving services, including maps, automated valet parking, autonomous navigation pilot, electric vehicles, and robotaxi fleets, as well as Xiaodu smart devices. Its iQIYI segment provides online entertainment service, including original and licensed content; and other video content, membership; and online advertising services. Baidu, Inc. has a strategic partnership with Zhejiang Geely Holding Group. The company was formerly known as Baidu.com, Inc. Baidu, Inc. was incorporated in 2000 and is headquartered in Beijing, China.",Beijing,86 10 5992 8888,,China,[],http://www.baidu.com,1.0,Baidu Campus,Internet Content & Information,0.32241002,0.42679,0.51787,26119999488,0.248,0.16617,36323999744.0,36.0,buy,53071000000.0,24634249216,259.24,144.13,624.387,2.865,0.0345,41.0,251.3,34.577,0.22313999,393.84,162337996800.0,82677997568.0,112663003136.0,482.431,CNY,332.156,2.565,2.0,NMS,"Baidu, Inc.","Baidu, Inc.",America/New_York,EST,True,-18000000,EQUITY,BIDU,finmb_428613,us_market,,-0.064,,-0.199,,,11.41,,347503008.0,,,,682.955,6036368.0,0.0174,,1609372800.0,0.65235,47995998208.0,21.476,,,0.2110388,0.0025600002,1672444800.0,,1617148800.0,0.94,1619740800.0,268510175.0,1.02663,-7228234752.0,2.0,,1273622400,10:1,,,,624.683,0.44456127,1622160000.0,71.34,,12.631903,,,7297202.0,,,,143.46,141.7,177.80435,,0.0,,144.17,,2949510.0,143.46,156.5924,,141.7,,2949510.0,,,,,,,140.265,USD,6.7112126,1136754.0,,,,50085609472.0,,,3647751.0,140.265,143.87,800.0,1136754.0,354.82,,,132.14,143.77,False,,800.0,144.17,144.13,,https://logo.clearbit.com/baidu.com,-4.990940559754808,-9.308663822840057,-30.127647544904967,-59.901149838694344,BIDU,86 10 5992 0000,No. 10 Shangdi 10th Street Haidian District,,,,dce9478c-eb4a-303c-a219-7348692ce9a8,CNY-USD,1,0.16,0.036,1.22,1.13,0.16
19,02142,Healthcare,9100.0,"Biogen Inc. discovers, develops, manufactures, and delivers therapies for treating neurological and neurodegenerative diseases. The company offers TECFIDERA, VUMERITY, AVONEX, PLEGRIDY, TYSABRI, and FAMPYRA for multiple sclerosis (MS); SPINRAZA for spinal muscular atrophy; and FUMADERM to treat plaque psoriasis. It also provides BENEPALI, an etanercept biosimilar referencing ENBREL; IMRALDI, an adalimumab biosimilar referencing HUMIRA; and FLIXABI, an infliximab biosimilar referencing REMICADE. In addition, the company offers RITUXAN for treating non-Hodgkin's lymphoma, chronic lymphocytic leukemia (CLL), rheumatoid arthritis, two forms of ANCA-associated vasculitis, and pemphigus vulgaris; RITUXAN HYCELA for non-Hodgkin's lymphoma and CLL; GAZYVA to treat CLL and follicular lymphoma; and OCREVUS for treating relapsing MS and primary progressive MS; and other anti-CD20 therapies. Further, it develops BIIB061, BIIB091, and BIIB107 for MS and neuroimmunology; Aducanumab, BAN2401, BIIB092, BIIB076, and BIIB080 to treat Alzheimer's disease and dementia; BIIB067, BIIB078, BIIB105, BIIB100, and BIIB110 to treat neuromuscular disorders; BIIB124, BIIB094, BIIB118, BIIB101, and BIIB122 for treating Parkinson's disease and movement disorders; BIIB111 and BIIB112 to treat ophthalmology related diseases; BIIB125 and BIIB104 for treating neuropsychiatry; Dapirolizumab pegol and BIIB059 to treat immunology related diseases; BIIB093 and TMS-007 to treat acute neurology; BIIB074 and BIIB095 for neuropathic pain; and SB11 and SB15 biosimilars, which are under various stages of development. The company has collaboration and license agreements with Acorda Therapeutics, Inc.; Alkermes Pharma Ireland Limited; Bristol-Myers Squibb Company; Eisai Co., Ltd.; Genentech, Inc.; Neurimmune SubOne AG; Ionis Pharmaceuticals, Inc.; Ginkgo Bioworks; Capsigen Inc.; and Mirimus, Inc. Biogen Inc. was founded in 1978 and is headquartered in Cambridge, Massachusetts.",Cambridge,617 679 2000,MA,United States,[],https://www.biogen.com,1.0,225 Binney Street,Drug Manufacturers—General,0.27191,0.13925,0.82522005,2434500096,-0.177,0.23021999,3018299904.0,209.0,buy,11639400000.0,1295462528,310.0,258.31,-0.502,1.701,0.06554,30.0,324.5,70.019,0.19474001,502.0,2955099904.0,7619299840.0,11100499968.0,20.117,USD,73.623,1.206,2.3,NMS,Biogen Inc.,Biogen Inc.,America/New_York,EST,True,-18000000,EQUITY,BIIB,finmb_29726,us_market,,3.584,,13.18,-0.031160176,,18.84,,146892992.0,,,,71.0,2325305.0,0.015800001,,1609372800.0,0.86644995,1545799936.0,10.217,,0.2825023,3.638169,0.00664,1672444800.0,,1632960000.0,1.72,1636934400.0,146490226.0,0.385691,39781212160.0,2.0,,979776000,3:1,,,,-0.531,3.0048065,1639526400.0,-1.89,,11.245905,,0.0179,2049474.0,,,,234.48,232.95,295.101,,0.0,,235.6,,1247290.0,234.48,251.9468,,232.95,,1247290.0,,,,,,,232.04,USD,12.102275,431676.0,,,,35149324288.0,,,1184896.0,232.04,233.74,1000.0,431676.0,468.55,,,221.72,233.6,False,,800.0,235.6,233.465,,https://logo.clearbit.com/biogen.com,0.5710682427167768,-0.0508217004266287,-3.3422029929601416,-43.095172444446206,BIIB,,,,,,9f757b3b-bb17-33fd-9f97-b619c9193382,USD-USD,1,0.16,0.036,1.22,1.13,1.0
20,06854,Consumer Cyclical,19600.0,"Booking Holdings Inc. provides travel and restaurant online reservation and related services worldwide. The company operates Booking.com, which offers online accommodation reservations; Rentalcars.com that provides online rental car reservation services; Priceline, which offer online travel reservation services, including hotel, rental car and airline ticket reservation services, as well as vacation packages and cruises; and Agoda that provides online accommodation reservation services, as well as flight, ground transportation and activities reservation services. It also operates KAYAK, an online price comparison service that allows consumers to search and compare travel itineraries and prices, comprising airline ticket, accommodation reservation, and rental car reservation information; and OpenTable for booking online restaurant reservations. Further, it offers travel-related insurance products, and restaurant management services. The company was formerly known as The Priceline Group Inc. and changed its name to Booking Holdings Inc. in February 2018. Booking Holdings Inc. was founded in 1997 and is headquartered in Norwalk, Connecticut.",Norwalk,203-299-8000,CT,United States,[],https://www.bookingholdings.com,1.0,800 Connecticut Avenue,Travel Services,0.22017999,0.04145,0.74974996,1964000000,0.771,0.17276,2028999936.0,1890.0,hold,4852000000.0,2417874944,2525.0,2405.52,-0.046,2.483,0.04375,26.0,2538.12,208.007,0.07305,3100.0,12165000192.0,11534000128.0,9214999552.0,296.249,USD,224.697,2.374,2.6,NMS,Booking Holdings Inc. Common St,Booking Holdings Inc.,America/New_York,EST,True,-18000000,EQUITY,BKNG,finmb_33254,us_market,,10.636,,48.306,,,92.62,,41052800.0,,,,116.051,497548.0,0.0121,,1609372800.0,0.92681,382000000.0,17.101,,,20.728128,0.0023999999,1672444800.0,,1632960000.0,1.17,1635465600.0,40934546.0,1.220779,98013757440.0,2.0,,1055721600,1:6,,,,-0.04,10.716585,1638230400.0,0.27,,25.971928,,0.012200001,668313.0,,,,2385.18,2407.76,2314.2996,,0.0,,2421.99,,355700.0,2385.18,2346.8406,,2407.76,,355700.0,,,,,,,2395.03,USD,140.66547,93474.0,,,,98753331200.0,,,342324.0,2395.03,2409.07,1000.0,93474.0,2687.29,,,1860.73,2401.81,False,,800.0,2421.99,2405.52,,https://logo.clearbit.com/bookingholdings.com,-0.02096277909130473,9.288221454894675,9.118698554125281,-9.950910973117333,BKNG,,,,,,dc582d30-8fc1-34d4-81b0-0893cd207cf5,USD-USD,1,0.16,0.036,1.22,1.13,1.0
21,95131-2313,Technology,21000.0,"Broadcom Inc. designs, develops, and supplies semiconductor infrastructure software solutions. It offers semiconductor devices with a focus on complex digital and mixed signal complementary metal oxide semiconductor based devices and analog III-V based products worldwide. The company's infrastructure software solutions enable customers to plan, develop, automate, manage, and secure applications across mainframe, distributed, mobile, and cloud platforms. It operates through two segments, Semiconductor Solutions and Infrastructure Software. The company was incorporated in 2018 and is based in San Jose, California.",San Jose,408 433 8000,CA,United States,[],http://www.broadcom.com,1.0,1320 Ridder Park Drive,Semiconductors,0.52531,0.22900999,0.73614,13571000320,0.164,0.28842,13925999616.0,475.0,buy,17370000000.0,11894375424,560.0,668.704,1.881,2.405,0.06159,30.0,551.83,166.032,0.25320998,600.0,11105000448.0,40456998912.0,26510000128.0,26.979,USD,64.975,2.052,2.0,NMS,Broadcom Inc.,Broadcom Inc.,America/New_York,EST,True,-18000000,EQUITY,AVGO,finmb_25016048,us_market,,9.023,,17.176,,,29.97,,410260992.0,,,,58.388,4454091.0,0.0108,,1604188800.0,0.82221,5773000192.0,10.759,,,11.452764,0.023929998,1667260800.0,,1627776000.0,3.71,1627603200.0,404515907.0,0.955786,239196291072.0,2.0,,,,,,,1.727,10.348667,1630368000.0,1.19,,22.312445,,0.0152,4775957.0,,,,655.2,656.13,499.5944,0.021443835,1.0407,,670.665,,3164230.0,655.2,571.652,14.05,656.13,,3164230.0,,,14.4,1632182400,,,656.13,USD,62.15299,1128105.0,,,,274343165952.0,,,2041145.0,656.13,670.46,1000.0,1128105.0,677.76,,2.71,419.14,670.03,False,0.028199999,1400.0,670.665,668.704,,https://logo.clearbit.com/broadcom.com,2.657199758877593,19.94765425949694,61.42616396133609,-0.24767809704433486,AVGO,,,,,,605f428a-c23f-303d-9bec-7b1a647c1b84,USD-USD,1,0.16,0.036,1.22,1.13,1.0
22,95134,Technology,8800.0,"Cadence Design Systems, Inc. provides software, hardware, services, and reusable integrated circuit (IC) design blocks worldwide. The company offers functional verification services, including emulation and prototyping hardware. Its functional verification offering consists of JasperGold, a formal verification platform; Xcelium, a parallel logic simulation platform; Palladium, an enterprise emulation platform; and Protium, a prototyping platform for chip verification. The company also provides digital IC design products, including Genus logic synthesis and RTL power solutions, as well as Modus software solution to reduce systems-on-chip design-for-test time; physical implementation tools, including place and route, optimization, and multiple patterning preparation; and signoff products to signoff the design as ready for manufacture by a silicon foundry. In addition, it offers custom IC design and simulation products to create schematic and physical representations of circuits down to the transistor level for analog, mixed-signal, custom digital, memory, and radio frequency designs; and system design and analysis products to develop printed circuit boards and IC packages, as well as to analyze electromagnetic, electro-thermal, and other multi-physics effects. Further, the company provides intellectual property (IP) products consisting of pre-verified and customizable functional blocks to integrate into customer's ICs; and verification IP and memory models to verify the correct interaction with dozens of design IP interface protocols. Additionally, it offers services related to methodology, education, and hosted design solutions, as well as technical support and maintenance services. Cadence Design Systems, Inc. was incorporated in 1988 and is headquartered in San Jose, California.",San Jose,408 943 1234,CA,United States,[],http://www.cadence.com,1.0,Building 5,Software—Application,0.31043,0.23297001,0.89552003,1020622976,0.126,0.26149,923560000.0,122.7,buy,2377393000.0,797867264,165.0,187.55,0.086,1.701,0.1164,17.0,159.51,13.202,0.27576,175.0,1013819008.0,347384992.0,2975117056.0,3.658,USD,10.869,1.487,2.3,NMS,"Cadence Design Systems, Inc.","Cadence Design Systems, Inc.",America/New_York,EST,True,-18000000,EQUITY,CDNS,finmb_25941,us_market,,16.473,,53.065,,,3.35,,278264992.0,,,,9.137,2718778.0,0.0098,,1609545600.0,0.88086,693113984.0,2.34,,,20.526432,0.01289,1672617600.0,,1633132800.0,2.48,1631664000.0,272967257.0,1.071168,49008320512.0,2.0,,879724800,2:1,,,,0.091,17.541697,1634256000.0,4.45,,55.985077,,0.012999999,2633919.0,,,,186.56,186.59,151.2091,,0.0,,188.149,,1516930.0,186.56,178.438,,186.59,,1516930.0,,,,,,,185.95,USD,80.149574,320916.0,,,,52188598272.0,,,1266379.0,185.95,187.15,1100.0,320916.0,192.7,,,118.11,187.06,False,,1100.0,188.149,187.55,,https://logo.clearbit.com/cadence.com,3.851829262294282,1.8158440973358614,41.05076400950176,-0.819197555663731,CDNS,408 428 5001,2655 Seely Avenue,,,,9b307be0-911d-321b-ac00-7b96e208b1c9,USD-USD,1,0.16,0.036,1.22,1.13,1.0
23,06901,Communication Services,96100.0,"Charter Communications, Inc. operates as a broadband connectivity and cable operator company serving residential and commercial customers in the United States. The company provides Internet services, such as security suite that protects computers from viruses and spyware; in-home WiFi, which provides customers with high performance wireless routers to enhance their in-home wireless Internet experience; out-of-home WiFi; and Spectrum WiFi services, as well as video services. It also offers voice communications services using voice over Internet protocol technology; and broadband communications solutions, such as Internet access, data networking, fiber connectivity, video entertainment, and business telephone services to cellular towers and office buildings for business and carrier organizations. In addition, the company provides mobile services; offers video programming, static IP and business WiFi, email and security, and multi-line telephone services, as well as Web-based service management; sells local advertising across various platforms for networks, such as MTV, CNN, and ESPN; sells advertising inventory to local sports and news channels; and offers Audience App for optimizes linear inventory. Further, it offers communications products and managed service solutions; data connectivity services to mobile and wireline carriers on a wholesale basis; and owns and operates regional sports and news networks. The company serves approximately 31 million customers in 41 states. Charter Communications, Inc. was founded in 1993 and is headquartered in Stamford, Connecticut.",Stamford,203-905-7801,CT,United States,[],https://corporate.charter.com,1.0,400 Atlantic Street,Entertainment,0.39200002,0.08396,0.44784,16161999872,0.092,0.20658001,20028999680.0,603.0,buy,21198000000.0,6336875008,802.0,656.28,0.667,0.286,0.04602,28.0,771.61,417.43,0.17694001,925.0,466000000.0,89856000000.0,51093999616.0,2.599,USD,270.338,0.254,2.4,NMS,"Charter Communications, Inc.","Charter Communications, Inc.",America/New_York,EST,True,-18000000,EQUITY,CHTR,finmb_19609,us_market,,4.139,,10.558,0.003519535,,31.38,,179291008.0,,,,94.985,7962171.0,0.0444,,1609372800.0,0.70921,4289999872.0,21.943,,0.2825023,6.9093018,0.3186,1672444800.0,,1632960000.0,6.06,1636934400.0,111735990.0,1.05238,211463290880.0,2.0,,,,,,,0.495,2.3916872,1639526400.0,0.78,,23.290545,,0.0865,8166362.0,179291008,,,639.79,641.34,701.05414,,0.0,,650.0,,1381200.0,639.79,674.1578,,641.34,,1381200.0,,,,,,,641.01,USD,36.60826,160088.0,,,,122200858624.0,,,1074067.0,641.01,649.87,1300.0,160088.0,825.62,,,585.45,649.52,False,,800.0,650.0,647.71,,https://logo.clearbit.com/corporate.charter.com,2.5774163140808826,-1.7824231283040892,-1.308302719992016,-20.06430841394683,CHTR,,,,,,8126b1f2-3d69-3a83-9d74-85cd4b083a2e,USD-USD,1,0.16,0.036,1.22,1.13,1.0
24,45262-5737,Industrials,40000.0,"Cintas Corporation provides corporate identity uniforms and related business services primarily in the United States, Canada, and Latin America. It operates through Uniform Rental and Facility Services, First Aid and Safety Services, and All Other segments. The company rents and services uniforms and other garments, including flame resistant clothing, mats, mops and shop towels, and other ancillary items; and provides restroom cleaning services and supplies, as well as sells uniforms. It also offers first aid and safety services, and fire protection products and services. The company provides its products and services through its distribution network and local delivery routes, or local representatives to small service and manufacturing companies, as well as major corporations. Cintas Corporation was founded in 1968 and is headquartered in Cincinnati, Ohio.",Cincinnati,513 459 1200,OH,United States,[],https://www.cintas.com,1.0,6800 Cintas Boulevard,Specialty Business Services,0.23646,0.15717,0.46668,1310589056,0.086,0.19748,1718322048.0,353.0,buy,3314651000.0,1093452416,420.0,436.93,0.119,1.092,0.11281,10.0,407.1,86.81,0.33038,450.0,79749000.0,2872723968.0,7266715136.0,0.771,USD,69.425,0.449,2.3,NMS,Cintas Corporation,Cintas Corporation,America/New_York,EST,True,-18000000,EQUITY,CTAS,finmb_260725,us_market,,6.503,,27.499,,,10.23,,105053000.0,,,,36.334,970591.0,0.0094,,1622419200.0,0.65827006,1134926976.0,9.136,,,12.025375,0.14829999,1685491200.0,,1630368000.0,3.09,1635465600.0,88047456.0,1.465974,47252049920.0,2.0,,952473600,3:2,,,,0.104,6.3165827,1638230400.0,3.31,,42.710655,,0.011,985178.0,,,,428.89,431.81,388.5043,0.009932617,0.5639,,442.31,,593310.0,428.89,436.8836,4.26,431.81,,593310.0,,,3.8,1636675200,,,431.76,USD,47.82509,268057.0,,,,45900808192.0,,,389514.0,431.76,437.38,1200.0,268057.0,461.44,,1.02,314.62,436.94,False,0.0088,900.0,442.31,436.93,,https://logo.clearbit.com/cintas.com,3.7422153104042177,2.348582153763301,29.241680126577087,-2.946888298810646,CTAS,,PO Box 625737,,,,1d3d7b01-7703-34ac-ba0b-74dff54e6e3b,USD-USD,1,0.16,0.036,1.22,1.13,1.0
25,95134,Technology,79500.0,"Cisco Systems, Inc. designs, manufactures, and sells Internet Protocol based networking and other products related to the communications and information technology industry in the Americas, Europe, the Middle East, Africa, the Asia Pacific, Japan, and China. It provides infrastructure platforms, including networking technologies of switching, routing, wireless, and data center products that are designed to work together to deliver networking capabilities, and transport and/or store data. The company also offers collaboration products comprising unified communications, Cisco TelePresence, and conferencing, as well as the Internet of Things and analytics software. In addition, it provides security products, such as network security, cloud and email security, identity and access management, advanced threat protection, and unified threat management products. Further, the company offers a range of service and support options for its customers, including technical support and advanced services. It serves businesses of various sizes, public institutions, governments, and service providers. The company sells its products and services directly, as well as through systems integrators, service providers, other resellers, and distributors. Cisco Systems, Inc. has strategic alliances with other companies. Cisco Systems, Inc. was incorporated in 1984 and is headquartered in San Jose, California.",San Jose,408 526 4000,CA,United States,[],https://www.cisco.com,1.0,170 West Tasman Drive,Communication Equipment,0.31235,0.2244,0.63726,14785000448,0.081,0.27665,15864000512.0,52.0,buy,31894000000.0,10929999872,59.5,62.245,0.373,1.618,0.09196,24.0,59.81,25.032,0.28190002,70.0,23352000512.0,10689000448.0,50788999168.0,5.537,USD,12.038,1.408,2.3,NMS,"Cisco Systems, Inc.","Cisco Systems, Inc.",America/New_York,EST,True,-18000000,EQUITY,CSCO,finmb_19691,us_market,,4.671,,14.954,,,3.4,,4214200064.0,,,,9.539,44962654.0,0.0107,,1627689600.0,0.75154996,11397000192.0,2.419,,,6.525317,0.00068999996,1690761600.0,,1635552000.0,1.85,1635465600.0,4214738583.0,0.912727,237230194688.0,2.0,,953769600,2:1,,,,0.371,5.1647577,1638230400.0,2.69,,18.307352,,0.0107,41416078.0,,,,61.53,61.79,54.8824,0.023565741,0.5465,,62.895,,23845260.0,61.53,57.2548,1.45,61.79,,23845260.0,,,1.48,1633305600,,,61.79,USD,25.731709,8554691.0,,,,262312886272.0,,,20342306.0,61.79,62.34,1800.0,8554691.0,63.84,,2.96,43.35,62.33,False,0.025,1800.0,62.895,62.245,,https://logo.clearbit.com/cisco.com,3.949293602120796,14.705884163868067,47.48097436646679,0.0,CSCO,,,,,,85fd1bb0-e226-3a6a-b3e9-b5dc1a4952f1,USD-USD,1,0.16,0.036,1.22,1.13,1.0
26,07666,Technology,318400.0,"Cognizant Technology Solutions Corporation, a professional services company, provides consulting and technology, and outsourcing services in North America, Europe, and internationally. The company operates through four segments: Financial Services; Healthcare; Products and Resources; and Communications, Media and Technology. It offers customer experience enhancement, robotic process automation, analytics, and AI services in areas, such as digital lending, fraud detection, and next generation payments; and enhanced compliance, integrated health management, claims investigative services, and patient experience, as well as services that drive operational improvements in areas, such as claims processing, enrollment, membership, and billing to healthcare providers and payers, and life sciences companies, including pharmaceutical, biotech, and medical device companies. The company also provides solution to manufacturers, retailers and travel and hospitality companies, as well as companies providing logistics, energy and utility services; and cloud, interactive, and IoT services to information, media and entertainment, and communications and technology companies. Cognizant Technology Solutions Corporation was founded in 1994 and is headquartered in Teaneck, New Jersey.",Teaneck,201-801-0233,NJ,United States,[],https://www.cognizant.com,1.0,300 Frank West Burr Boulevard,Information Technology Services,0.17601,0.104779996,0.37429002,2568000000,0.118,0.14519,3152999936.0,58.5,buy,6060000000.0,1644375040,89.5,86.33,0.609,2.108,0.09026,24.0,85.15,14.533,0.16548,95.0,2412999936.0,1678000000.0,17913999360.0,4.594,USD,33.928,1.89,2.4,NMS,Cognizant Technology Solutions ,Cognizant Technology Solutions Corporation,America/New_York,EST,True,-18000000,EQUITY,CTSH,finmb_386024,us_market,,2.39,,13.579,,,4.39,,527412000.0,,,,20.903,6775652.0,0.0128999995,,1609372800.0,0.93362,1876999936.0,2.846,,,4.130029,0.00127,1672444800.0,,1632960000.0,2.67,1635465600.0,524132948.0,1.126753,42813620224.0,2.0,,1394409600,2:1,,,,0.563,2.5416703,1638230400.0,1.59,,19.66515,,0.0128999995,6109746.0,,,,85.9,86.05,76.11325,0.010477299,0.26479998,,86.97,,2925570.0,85.9,80.9634,0.9,86.05,,2925570.0,,,0.96,1637193600,,,85.93,USD,30.333803,444090.0,,,,45531480064.0,,,2638614.0,85.93,86.47,1300.0,444090.0,88.89,,,66.19,86.44,False,0.0113,800.0,86.97,86.33,,https://logo.clearbit.com/cognizant.com,4.295686550017175,12.394928323794918,12.70856296903753,0.0,CTSH,,,,,,5d982cfb-cda3-3368-83e4-4d2610bc5294,USD-USD,1,0.16,0.036,1.22,1.13,1.0
