68,65802,Consumer Cyclical,80536.0,"O'Reilly Automotive, Inc., together with its subsidiaries, operates as a retailer of automotive aftermarket parts, tools, supplies, equipment, and accessories in the United States. The company provides new and remanufactured automotive hard parts and maintenance items, such as alternators, batteries, brake system components, belts, chassis parts, driveline parts, engine parts, fuel pumps, hoses, starters, temperature control, water pumps, antifreeze, appearance products, engine additives, filters, fluids, lighting products, and oil and wiper blades; and accessories, including floor mats, seat covers, and truck accessories. Its stores offer auto body paint and related materials, automotive tools, and professional service provider service equipment. The company's stores also offer enhanced services and programs comprising used oil, oil filter, and battery recycling; battery, wiper, and bulb replacement; battery diagnostic testing; electrical and module testing; check engine light code extraction; loaner tool program; drum and rotor resurfacing; custom hydraulic hoses; and professional paint shop mixing and related materials. Its stores provide do-it-yourself and professional service provider customers a selection of products for domestic and imported automobiles, vans, and trucks. As of December 31, 2020, the company operated 5,616 stores. O'Reilly Automotive, Inc. was founded in 1957 and is headquartered in Springfield, Missouri.",Springfield,417 862 6708,MO,United States,[],https://www.oreillyauto.com,1.0,233 South Patterson Avenue,Specialty Retail,0.24094999,0.15847,0.52527,3052801024,0.085,0.21601,3099738112.0,640.0,buy,6085692000.0,2146309760,700.5,678.87,0.141,0.762,0.14299,16.0,704.25,,7.17367,800.0,449302016.0,5892047872.0,12864842752.0,6.638,USD,183.309,0.141,2.3,NMS,"O'Reilly Automotive, Inc.","O'Reilly Automotive, Inc.",America/New_York,EST,True,-18000000,EQUITY,ORLY,finmb_324289,us_market,,4.1,,17.016,,,30.74,,67378400.0,,,,-2.081,598841.0,0.0089,,1609372800.0,0.82558995,2038657024.0,28.779,,,,0.0128999995,1672444800.0,,1632960000.0,1.51,1636934400.0,66714694.0,0.991688,52744814592.0,2.0,,1118880000,2:1,,,,0.06,3.5555177,1639526400.0,1.93,,22.084255,,0.009,630340.0,,,,687.74,692.46,601.17865,,0,,692.79,,407160.0,687.74,667.261,,692.46,,407160.0,,,,,,,674.77,USD,23.589075,590466.0,,,,45741174784.0,,,403690.0,674.77,0.0,1200.0,590466.0,710.86,,,424.03,0.0,False,,900.0,692.79,678.87,683,https://logo.clearbit.com/oreillyauto.com,-0.4954202832997412,-1.2136066979245186,46.32710944189944,-4.1333661318067705,ORLY,,,,,,bceb4e90-14a6-3e82-9996-5bc5c2d46a10,0.00308,USD-USD,USD-USD,1,0.157440647482872,0.03625684604048729,0.12832258641719818,1.1398608684539795,1.0,1.0
69,07666,Technology,318400.0,"Cognizant Technology Solutions Corporation, a professional services company, provides consulting and technology, and outsourcing services in North America, Europe, and internationally. The company operates through four segments: Financial Services; Healthcare; Products and Resources; and Communications, Media and Technology. It offers customer experience enhancement, robotic process automation, analytics, and AI services in areas, such as digital lending, fraud detection, and next generation payments; and enhanced compliance, integrated health management, claims investigative services, and patient experience, as well as services that drive operational improvements in areas, such as claims processing, enrollment, membership, and billing to healthcare providers and payers, and life sciences companies, including pharmaceutical, biotech, and medical device companies. The company also provides solution to manufacturers, retailers and travel and hospitality companies, as well as companies providing logistics, energy and utility services; and cloud, interactive, and IoT services to information, media and entertainment, and communications and technology companies. Cognizant Technology Solutions Corporation was founded in 1994 and is headquartered in Teaneck, New Jersey.",Teaneck,201-801-0233,NJ,United States,[],https://www.cognizant.com,1.0,300 Frank West Burr Boulevard,Information Technology Services,0.17601,0.104779996,0.37429002,2568000000,0.118,0.14519,3152999936.0,58.5,buy,6060000000.0,1644375040,91.0,87.2,0.609,2.108,0.09026,21.0,87.26,14.533,0.16548,100.0,2412999936.0,1678000000.0,17913999360.0,4.594,USD,33.928,1.89,2.4,NMS,Cognizant Technology Solutions ,Cognizant Technology Solutions Corporation,America/New_York,EST,True,-18000000,EQUITY,CTSH,finmb_386024,us_market,,2.639,,14.996,,,4.52,,525252000.0,,,,21.992,6327020.0,0.012,,1609372800.0,0.9332,1876999936.0,3.545,,,3.9650779,0.00127,1672444800.0,,1632960000.0,2.2,1636934400.0,524385069.0,1.126753,47283515392.0,2.0,,1394409600,2:1,,,,0.563,2.5863996,1639526400.0,1.61,,19.292034,,0.0121,6649465.0,,,,87.2,86.0,76.82385,0.010779817,0.26479998,,87.31,,2790650.0,87.2,83.5236,0.94,86.0,,2790650.0,,,0.96,1637193600,,,85.97,USD,24.598024,2327051.0,,,,46332760064.0,,,2639109.0,85.97,0.0,3200.0,2327051.0,92.03,,,66.19,0.0,False,0.0107,1100.0,87.31,87.2,86.22,https://logo.clearbit.com/cognizant.com,-0.2516600609827946,5.18696663837932,10.719610559161508,-4.61605918313902,CTSH,,,,,,5d982cfb-cda3-3368-83e4-4d2610bc5294,0.00306,USD-USD,USD-USD,1,0.157440647482872,0.03625684604048729,0.12832258641719818,1.1398608684539795,1.0,1.0
70,45262-5737,Industrials,40000.0,"Cintas Corporation provides corporate identity uniforms and related business services primarily in the United States, Canada, and Latin America. It operates through Uniform Rental and Facility Services, First Aid and Safety Services, and All Other segments. The company rents and services uniforms and other garments, including flame resistant clothing, mats, mops and shop towels, and other ancillary items; and provides restroom cleaning services and supplies, as well as sells uniforms. It also offers first aid and safety services, and fire protection products and services. The company provides its products and services through its distribution network and local delivery routes, or local representatives to small service and manufacturing companies, as well as major corporations. Cintas Corporation was founded in 1968 and is headquartered in Cincinnati, Ohio.",Cincinnati,513 459 1200,OH,United States,[],https://www.cintas.com,1.0,6800 Cintas Boulevard,Specialty Business Services,0.23546,0.155,0.46508,1381558016,0.094,0.19690001,1749892992.0,399.0,buy,3314651000.0,829024256,465.0,397.45,0.053,1.219,0.111049995,9.0,455.67,73.585,0.32173002,500.0,113170000.0,2621922048.0,7431948800.0,1.092,USD,71.233,0.541,2.2,NMS,Cintas Corporation,Cintas Corporation,America/New_York,EST,False,-18000000,EQUITY,CTAS,finmb_260725,us_market,,5.959,,25.308,,,11.98,,103664000.0,,,,34.372,1075084.0,0.0104,,1622419200.0,0.65788,1144331008.0,10.702,,,11.56319,0.14829999,1685491200.0,,1638230400.0,2.54,1636934400.0,88304479.0,1.46224,44285521920.0,2.0,,952473600,3:2,,,,0.034,5.5474925,1639526400.0,3.32,,33.17613,,0.012200001,1034447.0,,,,404.74,400.47,393.39154,0.008400455,0.3175,,402.62,,637580.0,404.74,433.4976,3.4,400.47,,637580.0,,,3.8,1644796800,,,394.74,USD,37.13792,426906.0,,,,41228681216.0,,,428133.0,394.74,0.0,1200.0,426906.0,461.44,,1.02,314.62,0.0,False,0.0095999995,1000.0,402.62,397.45,,https://logo.clearbit.com/cintas.com,0.00754838163234961,-13.165537211997059,24.52773251656295,-13.305703648329937,CTAS,,PO Box 625737,,,,,0.00301,USD-USD,USD-USD,1,0.157440647482872,0.03625684604048729,0.12832258641719818,1.1398608684539795,1.0,1.0
71,10018,Technology,2185.0,"Datadog, Inc. provides monitoring and analytics platform for developers, information technology operations teams, and business users in the cloud in North America and internationally. The company's SaaS platform integrates and automates infrastructure monitoring, application performance monitoring, log management, and security monitoring to provide real-time observability of customers technology stack. Its platform also provides user experience and network performance monitoring, incident management, and various shared features, such as sophisticated dashboards, advanced analytics, collaboration tools, and alerting capabilities. The company was incorporated in 2010 and is headquartered in New York, New York.",New York,866 329 4466,NY,United States,[],https://www.datadoghq.com,1.0,620 8th Avenue,Software—Application,-0.01891,-0.050079998,0.76405,194580000,0.749,-0.04153,-16647000.0,175.0,buy,473456000.0,174072624,200.0,138.28,,3.944,-0.0114,19.0,206.68,84.317,-0.046550002,236.0,1467126016.0,807257024.0,880116992.0,4.702,USD,2.866,3.843,2.1,NMS,"Datadog, Inc.","Datadog, Inc.",America/New_York,EST,False,-18000000,EQUITY,DDOG,finmb_134521275,us_market,,48.273,,-2552.157,0.395499,,0.58,,257196992.0,,,,3.07,15486332.0,0.0496,,1609372800.0,0.78554,-44074000.0,-0.144,,0.22741783,45.042347,0.08367,1672444800.0,,1632960000.0,3.89,1638230400.0,235662843.0,1.037911,42485755904.0,2.0,,,,,,,,49.02254,1640908800.0,11.49,,238.4138,,0.0621,11816348.0,312016000,,,135.13,135.34,130.09035,,0,,139.725,,4507700.0,135.13,172.6018,,135.34,,4507700.0,,,,,,,132.65,USD,,4274518.0,,,,43145572352.0,,,3633262.0,132.65,0.0,800.0,4274518.0,199.675,,,69.73,0.0,False,,2900.0,139.725,138.28,134,https://logo.clearbit.com/datadoghq.com,-3.8319735476107897,-19.143962504529142,39.5499080530499,-29.64997939721883,DDOG,,45th Floor,,,,085d3cdc-4322-3ea5-9645-762cfc47ec54,0.003,USD-USD,USD-USD,1,0.157440647482872,0.03625684604048729,0.12832258641719818,1.1398608684539795,1.0,1.0
72,95134,Technology,3153.0,"Zscaler, Inc. operates as a cloud security company worldwide. The company provides Zscaler Internet Access solution that provides users, servers, operational technology, Internet of Things device secure access to externally managed applications, including software-as-a-service (SaaS) applications and Internet destinations; and Zscaler Private Access solution, which is designed to provide access to managed applications hosted internally in data centers, and private or public clouds. It also offers Zscaler Digital Experience that measures end-to-end user experience across business applications, as well as provides an easy to understand digital experience score for each user, application, and location within an enterprise. In addition, the company provides workload segmentation solutions comprising Zscaler Cloud Security Posture Management that identifies and remediates application misconfigurations in SaaS, infrastructure as a service, and platform as a service to reduce risk and ensure compliance with industry and organizational benchmarks; and Zscaler Cloud Workload Segmentation, which is designed to secure application-to-application communications inside public clouds and data centers to stop lateral threat movement, as well as prevents application compromise and reduces the risk of data breaches. Its platform modules include Zscaler Central Authority, Zscaler Enforcement Node, and Zscaler Log Servers. It serves customers in airlines and transportation, conglomerates, consumer goods and retail, financial services, healthcare, manufacturing, media and communications, public sector and education, technology, and telecommunications services industries. The company was formerly known as SafeChannel, Inc., and changed its name to Zscaler, Inc. in August 2008. Zscaler, Inc. was incorporated in 2007 and is headquartered in San Jose, California.",San Jose,408 533 0288,CA,United States,[],https://www.zscaler.com,1.0,120 Holger Way,Software—Infrastructure,-0.27988002,-0.39134,0.77735,241779008,0.617,-0.31354,-213000000.0,286.0,buy,524019000.0,379834240,400.0,254.74,,2.594,-0.07232,32.0,387.78,184.466,-0.58265,500.0,1584642048.0,978035968.0,761038976.0,11.312,USD,5.55,2.46,2.0,NMS,"Zscaler, Inc.","Zscaler, Inc.",America/New_York,EST,False,-18000000,EQUITY,ZS,finmb_58838228,us_market,,46.092,,-164.685,0.20160377,,0.92,,140082000.0,,,,3.786,7938035.0,0.056700002,,1627689600.0,0.45471,-297824000.0,-2.172,,0.22741783,67.28474,0.41471002,1690761600.0,,1635638400.0,2.58,1638230400.0,82304990.0,0.905383,35077799936.0,2.0,,,,,,,,46.889175,1640908800.0,10.8,,273.91397,,0.0962,7027584.0,,,,250.47,248.0,253.63257,,0,,257.7,,2691680.0,250.47,316.1108,,248.0,,2691680.0,,,,,,,247.44,USD,,2071262.0,,,,35684491264.0,,,2315025.0,247.44,0.0,800.0,2071262.0,376.11,,,157.03,0.0,False,,800.0,257.7,254.74,254,https://logo.clearbit.com/zscaler.com,-2.596257912218647,-17.087614376358317,20.16037994960569,-30.923584159557993,ZS,,,,,,8a6b178d-3af0-35a9-b274-4ca31921d5e2,0.00298,USD-USD,USD-USD,1,0.157440647482872,0.03625684604048729,0.12832258641719818,1.1398608684539795,1.0,1.0
73,60015,Healthcare,202000.0,"Walgreens Boots Alliance, Inc. operates as a pharmacy-led health and beauty retail company. It operates through two segments, the United States and International. The United States segment sells prescription drugs and an assortment of retail products, including health, wellness, beauty, personal care, consumable, and general merchandise products through its retail drugstores. It also provides central specialty pharmacy services and mail services. As of August 31, 2021, this segment operated 8,965 retail stores under the Walgreens and Duane Reade brands in the United States; and five specialty pharmacies. The International segment sells prescription drugs; and health and wellness, beauty, personal care, and other consumer products through its pharmacy-led health and beauty retail stores and optical practices, as well as through boots.com and an integrated mobile application. It also engages in pharmaceutical wholesaling and distribution business in Germany. As of August 31, 2021, this segment operated 4,031 retail stores under the Boots, Benavides, and Ahumada in the United Kingdom, Thailand, Norway, the Republic of Ireland, the Netherlands, Mexico, and Chile; and 548 optical practices, including 160 on a franchise basis. Walgreens Boots Alliance, Inc. was founded in 1901 and is based in Deerfield, Illinois.",Deerfield,847 315 3700,IL,United States,[],https://www.walgreensbootsalliance.com,1.0,108 Wilmot Road,Pharmaceutical Retailers,0.0404,0.01918,0.21181,5554999808,0.128,0.02765,5352999936.0,45.0,hold,28067000000.0,2739249920,52.0,54.3,0.679,0.717,0.027190002,18.0,52.8,142.647,0.08636,70.0,1192999936.0,34434998272.0,132508999680.0,1.378,USD,153.225,0.311,3.0,NMS,"Walgreens Boots Alliance, Inc.","Walgreens Boots Alliance, Inc.",America/New_York,EST,True,-18000000,EQUITY,WBA,finmb_93624,us_market,,0.606,,14.993,,,5.1,,863945024.0,,,,27.062,16207157.0,0.0188,,1630368000.0,0.58089,1994000000.0,2.933,,,2.0065036,0.17283002,1693440000.0,,1630368000.0,2.4,1636934400.0,716077823.0,0.508051,80255950848.0,2.0,,919123200,2:1,,,,0.681,0.3540304,1639526400.0,3.7,,10.6470585,,0.0226,17650780.0,,,,54.19,54.12,50.28725,0.03469275,0.8174,,54.39,,7283570.0,54.19,49.7198,1.88,54.12,,7283570.0,,,1.91,1636675200,,,53.45,USD,18.513466,4473775.0,,,,46912212992.0,,,6060841.0,53.45,0.0,1800.0,4473775.0,57.05,,3.1,43.62,0.0,False,0.0357,1800.0,54.39,54.3,54.35,https://logo.clearbit.com/walgreensbootsalliance.com,0.8543816552172512,9.343534844755407,17.07948018372565,-1.6876231026870636,WBA,,,,,,888fa4a2-1f3d-3718-83dd-229207680ca9,0.00292,USD-USD,USD-USD,1,0.157440647482872,0.03625684604048729,0.12832258641719818,1.1398608684539795,1.0,1.0
74,95113,Technology,3871.0,"Zoom Video Communications, Inc. provides a video-first communications platform in the Americas, the Asia Pacific, Europe, the Middle East, and Africa. The company offers Zoom Meetings that offers HD video, voice, chat, and content sharing through mobile devices, desktops, laptops, telephones, and conference room systems; Zoom Phone, an enterprise cloud phone system that provides secure call routing, call queuing, call detail reports, call recording, call quality monitoring, voicemail, switch to video, and other services, as well as inbound and outbound calling services; and Zoom Chat enables to share messages, images, audio files, and content in desktop, laptop, tablet, and mobile devices for meeting and phone customers. It also provides Zoom Rooms, a software-based conference room system; Zoom Conference Room Connector, a gateway for SIP/H.323 endpoints to join Zoom meetings; Zoom Video Webinars to provide video presentations to large audiences from many devices; and Zoom Hardware-as-a-Service allows users to access video communication technology with subscription options for phone and meeting room hardware. The company offers Zoom for Developers to integrate its video, phone, chat, and content sharing into other applications, as well as manages Zoom accounts; Zoom App Marketplace enhance developers to publish their apps; OnZoom, a platform for users to create, host, and monetize online events; and Zoom Apps to access from Zoom Meetings and the Zoom Desktop client to facilitate collaboration and engagement during meetings. It serves individuals; and education, entertainment/media, enterprise infrastructure, finance, government, healthcare, manufacturing, non-profit/not for profit and social impact, retail/consumer products, and software/Internet industries. The company was formerly known as Zoom Communications, Inc. and changed its name to Zoom Video Communications, Inc. in May 2012. The company was incorporated in 2011 and is headquartered in San Jose, California.",San Jose,888 799 9666,CA,United States,[],https://www.zoom.us,1.0,55 Almaden Boulevard,Software—Application,0.3041,0.29292,0.72782,1795266048,0.352,0.29266,1189319936.0,200.0,buy,1829379000.0,1513425152,296.0,159.72,0.677,3.614,0.14265001,27.0,319.26,1.905,0.34644002,643.0,5417954816.0,97393000.0,3910972928.0,18.181,USD,13.318,3.427,2.3,NMS,"Zoom Video Communications, Inc.","Zoom Video Communications, Inc.",America/New_York,EST,False,-18000000,EQUITY,ZM,finmb_223236753,us_market,,11.715,,38.522,,,4.37,,242240000.0,,,,17.164,9109055.0,0.0306,,1612051200.0,0.61362,1144920064.0,3.763,,,9.305524,0.13697,1675123200.0,,1635638400.0,1.51,1636934400.0,218608815.0,-1.242781,45815304192.0,2.0,,,,,,,0.714,12.169801,1639526400.0,2.72,,36.549202,,0.0377,7978222.0,,,,162.1,161.42,295.05124,,0,,164.89,,3722800.0,162.1,206.2478,,161.42,,3722800.0,,,,,,,156.88,USD,42.44486,4700697.0,,,,47595761664.0,,,4379975.0,156.88,0.0,1200.0,4700697.0,451.77,,,156.88,0.0,False,,1200.0,164.89,159.72,158.1,https://logo.clearbit.com/zoom.us,-6.923079522296771,-13.068086357788511,-59.44854820099157,-64.0683004405417,ZM,,6th Floor,,,,70f73ee5-133f-39c2-b135-16067fabfd87,0.00292,USD-USD,USD-USD,1,0.157440647482872,0.03625684604048729,0.12832258641719818,1.1398608684539795,1.0,1.0
75,43215-2373,Utilities,16787.0,"American Electric Power Company, Inc., an electric public utility holding company, engages in the generation, transmission, and distribution of electricity for sale to retail and wholesale customers in the United States. It operates through Vertically Integrated Utilities, Transmission and Distribution Utilities, AEP Transmission Holdco, and Generation & Marketing segments. The company generates electricity using coal and lignite, natural gas, nuclear, and hydroelectric, as well as solar, wind, and other energy sources. It also supplies and markets electric power at wholesale to other electric utility companies, rural electric cooperatives, municipalities, and other market participants. The company owns, leases, or controls approximately 3,016 railcars, 411 barges, 6 towboats, and a coal handling terminal with approximately 18 million tons of annual capacity. American Electric Power Company, Inc. was incorporated in 1906 and is headquartered in Columbus, Ohio.",Columbus,614-716-1000,OH,United States,[],https://www.aep.com,1.0,1 Riverside Plaza,Utilities—Regulated Electric,0.37291,0.14593,0.45705003,3883699968,0.137,0.20907,6093799936.0,84.0,buy,6966000000.0,-1712162560,94.78,90.98,0.053,0.581,0.025880001,16.0,96.91,168.289,0.11048,112.0,1591100032.0,37910900736.0,16341199872.0,3.159,USD,32.769,0.389,2.2,NMS,American Electric Power Company,"American Electric Power Company, Inc.",America/New_York,EST,True,-18000000,EQUITY,AEP,finmb_135470,us_market,,4.97,,13.328,,,4.97,,496390016.0,,,,44.24,5547433.0,0.0112,,1609372800.0,0.74028,2384699904.0,4.762,,,2.05651,0.00024000001,1672444800.0,,1632960000.0,2.0,1636934400.0,503153062.0,0.345454,81217617920.0,2.0,,,,,,,0.063,2.7636628,1639526400.0,3.44,,18.305836,,0.0112,5982115.0,,,,90.86,91.13,86.1162,0.032577593,0.6218,,91.31,,2946840.0,90.86,85.628,2.96,91.13,,2946840.0,,,3.12,1636416000,,,90.28,USD,19.10542,4088470.0,,,,45161566208.0,,,2662979.0,90.28,0.0,4000.0,4088470.0,91.58,,3.31,74.8,0.0,False,0.0352,1800.0,91.31,90.98,,https://logo.clearbit.com/aep.com,0.19823821489650673,4.298979543375103,16.771420457883714,0.0,AEP,,,,,,31a5c29e-9305-3849-a05f-4a7df17372c6,0.00292,USD-USD,USD-USD,1,0.157440647482872,0.03625684604048729,0.12832258641719818,1.1398608684539795,1.0,1.0
76,15222,Consumer Defensive,38000.0,"The Kraft Heinz Company, together with its subsidiaries, manufactures and markets food and beverage products in the United States, Canada, the United Kingdom, and internationally. Its products include condiments and sauces, cheese and dairy, meals, meats and seafood, frozen and chilled foods, packaged drinking pouches, appetizers, nuts and salted snacks, refreshment beverages, coffee, infant and nutrition products, and other grocery products, as well as desserts, dressings, toppings, and baking. The company offers its products under the Kraft, Oscar Mayer, Heinz, Philadelphia, Velveeta, Lunchables, Planters, Maxwell House, Capri Sun, Ore-Ida, Kool-Aid, Jell-O, ABC, Master, Golden Circle, Quero, Plasmon, Wattie's, Pudliszki, Classico, TGI Fridays, and Taco Bell Home Originals brand names. It sells its products through its own sales organizations, as well as through independent brokers, agents, and distributors to chain, wholesale, cooperative and independent grocery accounts, convenience stores, drug stores, value stores, bakeries, pharmacies, mass merchants, club stores, foodservice distributors and institutions, including hotels, restaurants, hospitals, health care facilities, and government agencies; and online through e-commerce platforms and retailers. The company was formerly known as H.J. Heinz Holding Corporation and changed its name to The Kraft Heinz Company in July 2015. The Kraft Heinz Company was founded in 1869 and is headquartered in Pittsburgh, Pennsylvania.",Pittsburgh,412 456 5700,PA,United States,[],https://www.kraftheinzcompany.com,1.0,One PPG Place,Packaged Foods,0.25506002,0.08758,0.34428,4051000064,-0.018,0.21989,6701000192.0,33.0,hold,9171000000.0,3095749888,40.0,38.02,0.209,1.13,0.03741,21.0,39.93,47.922,0.04646,50.0,2272999936.0,24074999808.0,26272000000.0,1.855,USD,21.455,0.5,2.8,NMS,The Kraft Heinz Company,The Kraft Heinz Company,America/New_York,EST,True,-18000000,EQUITY,KHC,finmb_278212,us_market,,2.609,,10.228,0.17490733,,2.62,,1224039936.0,,,,40.822,18989236.0,0.0155,,1608940800.0,0.77672,2300999936.0,1.858,0.4,0.22741783,0.9313606,0.0165,1672012800.0,,1632528000.0,2.41,1638230400.0,707686529.0,1.078961,68535443456.0,2.0,,,,,1637712000,,0.228,1.7713915,1640908800.0,-3.9,,14.401515,,0.0286,21360633.0,,,,37.65,37.62,38.465324,0.042496677,0.8556,,38.115,,6245920.0,37.65,35.7874,1.6,37.62,,6245920.0,,,1.6,1637712000,,,37.375,USD,20.462864,5354454.0,,,,46537998336.0,,,7222919.0,37.375,0.0,2200.0,5354454.0,44.95,,4.61,31.855,0.0,False,0.044299997,3000.0,38.115,38.02,37.95,https://logo.clearbit.com/kraftheinzcompany.com,1.7938474190482445,9.002291552447229,22.485899493678918,-11.870717976641664,KHC,,,,,,aa94f7c2-b9a7-3327-84d9-2c52fccdd6df,0.0028799999999999997,USD-USD,USD-USD,1,0.157440647482872,0.03625684604048729,0.12832258641719818,1.1398608684539795,1.0,1.0
77,94086,Technology,4543.0,"CrowdStrike Holdings, Inc. provides cloud-delivered solutions for endpoint and cloud workload protection in the United States, Australia, Germany, India, Israel, Romania, and the United Kingdom. It offers 19 cloud modules on its Falcon platform through a software as a service subscription-based model that covers various security markets, such as corporate workload security, security and vulnerability management, managed security services, IT operations management, threat intelligence services, identity protection, and log management. The company primarily sells its platform and cloud modules through its direct sales team. CrowdStrike Holdings, Inc. was incorporated in 2011 and is headquartered in Sunnyvale, California.",Sunnyvale,888 512 8906,CA,United States,[],https://www.crowdstrike.com,1.0,150 Mathilda Place,Software—Infrastructure,-0.06068,-0.16478,0.73759,529528992,0.635,-0.099,-78011000.0,224.0,buy,644893000.0,582539520,300.0,176.7,,1.901,-0.03151,29.0,294.31,80.947,-0.23629999,350.0,1907507968.0,776745984.0,1285512960.0,8.317,USD,5.71,1.765,1.8,NMS,"CrowdStrike Holdings, Inc.","CrowdStrike Holdings, Inc.",America/New_York,EST,False,-18000000,EQUITY,CRWD,finmb_420347413,us_market,,32.578,,-536.84,,,0.9,,208207008.0,,,,4.135,11665310.0,0.0509,,1612051200.0,0.72842,-211824000.0,-0.941,,,42.732765,0.01426,1675123200.0,,1635638400.0,2.26,1636934400.0,205994865.0,1.375652,41879453696.0,2.0,,,,,,,,31.52376,1639526400.0,4.38,,196.33333,,0.056700002,11225885.0,,,,174.9,173.87,236.7361,,0,,181.42,,5566870.0,174.9,220.6832,,173.87,,5566870.0,,,,,,,172.17,USD,,4674749.0,,,,40524201984.0,,,3981653.0,172.17,0.0,3200.0,4674749.0,298.48,,,168.67,0.0,False,,800.0,181.42,176.7,172.9,https://logo.clearbit.com/crowdstrike.com,-6.502993908514609,-16.140671388145677,-20.376713046959217,-39.72985832507019,CRWD,,Suite 300,,,,91e696a0-f87a-3aaf-b2cd-1bd49fbc1d92,0.0028000000000000004,USD-USD,USD-USD,1,0.157440647482872,0.03625684604048729,0.12832258641719818,1.1398608684539795,1.0,1.0
