25,94086-5304,Healthcare,8081.0,"Intuitive Surgical, Inc., together with its subsidiaries, designs, develops, manufactures, and markets da Vinci surgical systems, and related instruments and accessories in the United States and internationally. The company's da Vinci Surgical System include surgeon's consoles, patient-side carts, 3-D HD vision systems, skills simulators, da Vinci Xi integrated table motions, and Firefly fluorescence imaging products that enable surgeons to perform various surgical procedures, including gynecologic, urologic, general, cardiothoracic, and head and neck surgical procedures. It also manufactures EndoWrist instruments, such as forceps, scissors, electrocautery tools, scalpels, and other surgical tools, which incorporate wrist joints for natural dexterity for various surgical procedures; and provides SimNow, a cloud-enabled simulation platform, which allows surgeons to learn and practice their surgical skills; Iris, an augmented reality imaging product for use in kidney procedures; and Intuitive Cloud that enables proactive monitoring and software updates. In addition, the company offers EndoWrist Stapler, a wristed stapling instrument for resection, transection, and creation of anastomoses; EndoWrist One Vessel Sealers that are wristed single-use instruments for bipolar coagulation and mechanical transection of vessels up to 7mm in diameter and tissue bundles that fit in the jaws of the instrument; E-100 generator, an electrosurgical generator; SureForm 45 Curved-Tip stapler; and SynchroSeal for sealing and transection with a single pedal press. Additionally, the company sells various accessories comprising sterile drapes for ensuring sterile field during surgery; and vision products that include replacement 3D stereo endoscopes, camera heads, light guides, and other items that facilitate the use of the da Vinci Surgical System, as well as Ion endoluminal system for biopsies. Intuitive Surgical, Inc. was founded in 1995 and is headquartered in Sunnyvale, California.",Sunnyvale,408 523 2100,CA,United States,[],https://www.intuitive.com,1.0,1020 Kifer Road,Medical Instruments & Supplies,0.38052,0.30777,0.69117,2149199872,0.302,0.32526,2088499968.0,289.67,buy,2861200000.0,1669049984,370.0,307.74,0.195,5.576,0.09475,15.0,362.13,,0.16475001,425.0,4132000000.0,0.0,5488500224.0,11.567,USD,15.468,4.795,2.1,NMS,"Intuitive Surgical, Inc.","Intuitive Surgical, Inc.",America/New_York,EST,False,-18000000,EQUITY,ISRG,finmb_30239,us_market,,19.286,,50.684,0.18603301,,5.54,,357236992.0,,,,31.945,2795747.0,0.0078,,1609372800.0,0.86401004,1689200000.0,4.638,,0.22741783,9.633432,0.0096700005,1672444800.0,,1632960000.0,1.69,1638230400.0,353853828.0,1.098834,105852674048.0,2.0,,1633392000,3:1,,,,0.212,20.030264,1640908800.0,3.6,,55.548737,,0.007900001,2577342.0,,,,313.21,310.39,321.24326,,0.0,,311.505,,1814390.0,313.21,343.5766,,310.39,,1814390.0,,,,,,,303.89,USD,66.351875,2299939.0,,,,109936107520.0,,,1614370.0,303.89,0.0,900.0,2299939.0,369.69,,,227.46666,0.0,False,,1000.0,311.505,307.74,300.1,https://logo.clearbit.com/intuitive.com,-5.103462294384653,-7.212209239466738,18.603302419000567,-15.784582418545124,ISRG,408 523 1390,,,,,,0.00855,USD-USD,USD-USD,1,0.157440647482872,0.03625684604048729,0.12832258641719818,1.1398608684539795,1.0,1.0
26,91320-1799,Healthcare,24300.0,"Amgen Inc. discovers, develops, manufactures, and delivers human therapeutics worldwide. It focuses on inflammation, oncology/hematology, bone health, cardiovascular disease, nephrology, and neuroscience areas. The company's products include Enbrel to treat plaque psoriasis, rheumatoid arthritis, and psoriatic arthritis; Neulasta that reduces the chance of infection due a low white blood cell count in patients cancer; Prolia to treat postmenopausal women with osteoporosis; Xgeva for skeletal-related events prevention; Otezla for the treatment of adult patients with plaque psoriasis, psoriatic arthritis, and oral ulcers associated with BehÃ§et's disease; Aranesp to treat a lower-than-normal number of red blood cells and anemia; KYPROLIS to treat patients with relapsed or refractory multiple myeloma; and Repatha, which reduces the risks of myocardial infarction, stroke, and coronary revascularization. It also markets Nplate, Vectibix, MVASI, Parsabiv, EPOGEN, KANJINTI, BLINCYTO, Aimovig, EVENITY, AMGEVITATM, Sensipar/Mimpara, NEUPOGEN, IMLYGIC, Corlanor, and AVSOLA. Amgen Inc. serves healthcare providers, including physicians or their clinics, dialysis centers, hospitals, and pharmacies. It distributes its products through pharmaceutical wholesale distributors, as well as direct-to-consumer channels. The company has collaboration agreements with Novartis Pharma AG; UCB; Bayer HealthCare LLC; BeiGene, Ltd.; Eli Lilly and Company; Datos Health; and Verastem, Inc. to evaluate VS-6766 in combination with lumakrastm (Sotorasib) in patients with KRAS G12C-mutant non-small cell lung cancer. It has an agreement with Kyowa Kirin Co., Ltd. to jointly develop and commercialize KHK4083, a Phase 3-ready anti-OX40 fully human monoclonal antibody for the treatment of atopic dermatitis and other autoimmune diseases; and a strategic research and development collaboration with Neumora Therapeutics, Inc. Amgen Inc. was founded in 1980 and is headquartered in Thousand Oaks, California.",Thousand Oaks,805 447 1000,CA,United States,[],https://www.amgen.com,1.0,One Amgen Center Drive,Drug Manufacturers—General,0.47642,0.21767999,0.75421995,8606000128,0.044,0.34998,12275999744.0,185.0,hold,19265000000.0,7394749952,235.0,235.36,-0.035,1.643,0.08696,24.0,239.96,457.332,0.585,298.0,12920999936.0,37579001856.0,25767000064.0,22.939,USD,44.89,1.192,2.6,NMS,Amgen Inc.,Amgen Inc.,America/New_York,EST,False,-18000000,EQUITY,AMGN,finmb_24816,us_market,,6.102,,12.808,-0.051999867,,17.94,,563265984.0,,,,14.543,12067973.0,0.0214,,1609372800.0,0.77134,5608999936.0,9.701,1.76,0.22741783,16.183731,0.00214,1672444800.0,,1632960000.0,3.97,1638230400.0,562184431.0,0.639128,157228269568.0,2.0,,943228800,2:1,,1636934400,,-0.068,5.1449637,1640908800.0,2.87,,13.119287,,0.0215,12936104.0,,,,230.85,230.69,228.90096,0.029802902,0.7093,,235.75,,2514230.0,230.85,215.827,6.88,230.69,,2514230.0,,,7.76,1644796800,,,229.99,USD,24.261415,3012090.0,,,,132570284032.0,,,2781803.0,229.99,0.0,1100.0,3012090.0,276.69,,2.73,198.64,0.0,False,0.033,1100.0,235.75,235.36,233.61,https://logo.clearbit.com/amgen.com,3.550533486997609,7.3477767892139445,-2.2671881515379577,-7.057809669003534,AMGN,805 447 1010,,,,,,0.00835,USD-USD,USD-USD,1,0.157440647482872,0.03625684604048729,0.12832258641719818,1.1398608684539795,1.0,1.0
27,06901,Communication Services,96100.0,"Charter Communications, Inc. operates as a broadband connectivity and cable operator company serving residential and commercial customers in the United States. The company provides Internet services, such as security suite that protects computers from viruses and spyware; in-home WiFi, which provides customers with high performance wireless routers to enhance their in-home wireless Internet experience; out-of-home WiFi; and Spectrum WiFi services, as well as video services. It also offers voice communications services using voice over Internet protocol technology; and broadband communications solutions, such as Internet access, data networking, fiber connectivity, video entertainment, and business telephone services to cellular towers and office buildings for business and carrier organizations. In addition, the company provides mobile services; offers video programming, static IP and business WiFi, email and security, and multi-line telephone services, as well as Web-based service management; sells local advertising across various platforms for networks, such as MTV, CNN, and ESPN; sells advertising inventory to local sports and news channels; and offers Audience App for optimizes linear inventory. Further, it offers communications products and managed service solutions; data connectivity services to mobile and wireline carriers on a wholesale basis; and owns and operates regional sports and news networks. The company serves approximately 31 million customers in 41 states. Charter Communications, Inc. was founded in 1993 and is headquartered in Stamford, Connecticut.",Stamford,203-905-7801,CT,United States,[],https://corporate.charter.com,1.0,400 Atlantic Street,Entertainment,0.39200002,0.08396,0.44784,16161999872,0.092,0.20658001,20028999680.0,603.0,buy,21198000000.0,6336875008,755.0,607.69,0.667,0.286,0.04602,28.0,754.39,417.43,0.17694001,925.0,466000000.0,89856000000.0,51093999616.0,2.599,USD,270.338,0.254,2.5,NMS,"Charter Communications, Inc.","Charter Communications, Inc.",America/New_York,EST,False,-18000000,EQUITY,CHTR,finmb_19609,us_market,,3.97,,10.127,-0.04039353,,31.22,,179291008.0,,,,94.985,10978930.0,0.0612,,1609372800.0,0.70857,4289999872.0,21.943,,0.22741783,6.397747,0.3186,1672444800.0,,1632960000.0,7.88,1638230400.0,111735990.0,0.944247,202839392256.0,2.0,,,,,,,0.495,2.13241,1640908800.0,0.73,,19.464767,,0.1193,8097157.0,179291008,,,619.08,618.13,700.7523,,0.0,,619.46,,1244470.0,619.08,653.2316,,618.13,,1244470.0,,,,,,,600.535,USD,27.694025,1070613.0,,,,108953354240.0,,,1136175.0,600.535,0.0,1100.0,1070613.0,825.62,,,585.45,0.0,False,,1100.0,619.46,607.69,598.25,https://logo.clearbit.com/corporate.charter.com,-0.4586459790919428,-1.5599696702774724,-4.039353877636309,-25.982631732482233,CHTR,,,,,,,0.00772,USD-USD,USD-USD,1,0.157440647482872,0.03625684604048729,0.12832258641719818,1.1398608684539795,1.0,1.0
28,83716-9632,Technology,43000.0,"Micron Technology, Inc. designs, manufactures, and sells memory and storage products worldwide. The company operates through four segments: Compute and Networking Business Unit, Mobile Business Unit, Storage Business Unit, and Embedded Business Unit. It provides memory and storage technologies comprises DRAM products, which are dynamic random access memory semiconductor devices with low latency that provide high-speed data retrieval; NAND products that are non-volatile and re-writeable semiconductor storage devices; and NOR memory products, which are non-volatile re-writable semiconductor memory devices that provide fast read speeds under the Micron and Crucial brands, as well as through private labels. The company offers memory products for the cloud server, enterprise, client, graphics, and networking markets, as well as for smartphone and other mobile-device markets; SSDs and component-level solutions for the enterprise and cloud, client, and consumer storage markets; other discrete storage products in component and wafers; and memory and storage products for the automotive, industrial, and consumer markets. It markets its products through its direct sales force, independent sales representatives, distributors, and retailers; and web-based customer direct sales channel, as well as through channel and distribution partners. Micron Technology, Inc. was founded in 1978 and is headquartered in Boise, Idaho.",Boise,208 368 4000,ID,United States,[],https://www.micron.com,1.0,8000 South Federal Way,Semiconductors,0.50606,0.24861999,0.41531,14439000064,0.332,0.29005,14988999680.0,58.0,buy,10472000000.0,1410875008,110.0,97.36,1.873,3.101,0.093430005,35.0,109.09,16.561,0.17163,165.0,9580000256.0,7602999808.0,29618999296.0,8.555,USD,26.422,2.277,2.0,NMS,"Micron Technology, Inc.","Micron Technology, Inc.",America/New_York,EST,False,-18000000,EQUITY,MU,finmb_289030,us_market,,3.614,,7.142,0.13871348,,11.68,,1119779968.0,,,,40.989,24893381.0,0.0222,,1630540800.0,0.80081004,7363999744.0,6.461,0.1,0.22741783,2.3752716,0.0020299999,1693612800.0,,1638403200.0,1.18,1638230400.0,1116697723.0,1.149518,107044495360.0,2.0,,957225600,2:1,,1640908800,,1.872,3.6808057,1640908800.0,0.46,,8.335616,,0.0223,24081889.0,,,,95.62,94.44,79.9055,0.0020916127,0.0155,,97.43,,19481610.0,95.62,85.8588,0.2,94.44,,19481610.0,,,0.2,1640908800,,,94.4175,USD,15.068875,18384993.0,,,,109021782016.0,,,19396022.0,94.4175,0.0,900.0,18384993.0,98.45,,,65.67,0.0,False,0.0021,1200.0,97.43,97.36,95.51,https://logo.clearbit.com/micron.com,3.0809992124235075,13.779827687512203,14.152094972991547,0.0,MU,208 368 4617,,,,,,0.0068200000000000005,USD-USD,USD-USD,1,0.157440647482872,0.03625684604048729,0.12832258641719818,1.1398608684539795,1.0,1.0
29,07068,Industrials,56000.0,"Automatic Data Processing, Inc. provides cloud-based human capital management solutions worldwide. It operates in two segments, Employer Services and Professional Employer Organization (PEO). The Employer Services segment offers strategic, cloud-based platforms, and human resources (HR) outsourcing solutions. Its offerings include payroll, benefits administration, talent management, HR management, workforce management, insurance, retirement, and compliance services. The PEO Services segment provides HR outsourcing solutions to small and mid-sized businesses through a co-employment model. This segment offers benefits package, protection and compliance, talent engagement, comprehensive outsourcing, and recruitment process outsourcing services. The company was founded in 1949 and is headquartered in Roseland, New Jersey.",Roseland,973 974 5000,NJ,United States,[],https://www.adp.com,1.0,One ADP Boulevard,Staffing & Employment Services,0.26052,0.17549999,0.45167,2733299968,0.104,0.22742,4003500032.0,171.0,hold,6768100000.0,3333612544,238.0,228.75,0.179,1.048,0.04267,17.0,231.49,65.01,0.48333,260.0,1630599936.0,3478500096.0,15367000064.0,3.87,USD,36.2,0.089,3.0,NMS,"Automatic Data Processing, Inc.","Automatic Data Processing, Inc.",America/New_York,EST,False,-18000000,EQUITY,ADP,finmb_126269,us_market,,6.393,,24.538,0.41221142,,7.47,,421384000.0,,,,12.679,4921101.0,0.0117,,1625011200.0,0.80823,2696900096.0,6.32,1.04,0.22741783,18.041643,0.00099,1688083200.0,,1632960000.0,3.1,1638230400.0,420680331.0,0.763811,98239496192.0,2.0,,1412121600,1139:1000,,1639008000,,0.163,6.272636,1640908800.0,2.41,,30.62249,,0.0117,4031983.0,,,,231.93,229.94,210.5099,0.016039323,0.5886,,231.19,,1620940.0,231.93,235.1194,3.72,229.94,,1620940.0,,,4.16,1646870400,,,226.94,USD,36.19462,1562921.0,,,,96391593984.0,,,1447254.0,226.94,0.0,800.0,1562921.0,248.96,,2,159.81,0.0,False,0.0182,800.0,231.19,228.75,,https://logo.clearbit.com/adp.com,-4.224584028052048,-2.210156553272269,43.90369252749713,-7.7658138516289,ADP,,,,,,,0.00681,USD-USD,USD-USD,1,0.157440647482872,0.03625684604048729,0.12832258641719818,1.1398608684539795,1.0,1.0
30,94538,Technology,15400.0,"Lam Research Corporation designs, manufactures, markets, refurbishes, and services semiconductor processing equipment used in the fabrication of integrated circuits. The company offers ALTUS systems to deposit conformal films for tungsten metallization applications; SABRE electrochemical deposition products for copper interconnect transition that offers copper damascene manufacturing; SOLA ultraviolet thermal processing products for film treatments; and VECTOR plasma-enhanced CVD ALD products. It also provides SPEED gapfill high-density plasma chemical vapor deposition products; and Striker single-wafer atomic layer deposition products for dielectric film solutions. In addition, the company offers Flex for dielectric etch applications; Kiyo for conductor etch applications; Syndion for through-silicon via etch applications; and Versys metal products for metal etch processes. Further, it provides Coronus bevel clean products to enhance die yield; Da Vinci, DV-Prime, EOS, and SP series products to address various wafer cleaning applications; and Metryx mass metrology systems for high precision in-line mass measurement in semiconductor wafer manufacturing. The company sells its products and services to semiconductors industry in the United States, China, Europe, Japan, Korea, Southeast Asia, Taiwan, and internationally. Lam Research Corporation was incorporated in 1980 and is headquartered in Fremont, California.",Fremont,510 572 0200,CA,United States,[],https://www.lamresearch.com,1.0,4650 Cushing Parkway,Semiconductor Equipment & Materials,0.33055001,0.27072,0.46186,3403175936,0.355,0.31061,5207305216.0,597.0,buy,6805306000.0,1959992704,750.0,729.82,0.479,3.269,0.19974001,27.0,742.78,85.83,0.7589,869.0,4611622912.0,4995332096.0,15753535488.0,32.753,USD,110.375,2.349,2.2,NMS,Lam Research Corporation,Lam Research Corporation,America/New_York,EST,False,-18000000,EQUITY,LRCX,finmb_30655,us_market,,6.547,,19.807,0.25826693,,37.0,,140799008.0,,,,41.332,1860907.0,0.013200001,,1624752000.0,0.84484,4264751104.0,29.588,1.5,0.22741783,17.657505,0.00208,1687824000.0,,1632614400.0,1.44,1638230400.0,140350957.0,1.169792,103141416960.0,2.0,,953251200,3:1,,1639440000,,0.433,6.522849,1640908800.0,1.31,,19.724865,,0.013200001,2058060.0,,,,686.77,683.57,625.6098,0.007862895,0.1826,,730.7,,1500120.0,686.77,672.4252,5.4,683.57,,1500120.0,,,6,1639440000,,,681.8,USD,24.666082,1941618.0,,,,102757933056.0,,,1383541.0,681.8,0.0,900.0,1941618.0,731.85,,1.39,481.05,0.0,False,0.0082,1200.0,730.7,729.82,714.51,https://logo.clearbit.com/lamresearch.com,9.043916879687997,4.662203306914914,26.973200215774472,0.0,LRCX,,,,,,,0.00662,USD-USD,USD-USD,1,0.157440647482872,0.03625684604048729,0.12832258641719818,1.1398608684539795,1.0,1.0
31,06854,Consumer Cyclical,19600.0,"Booking Holdings Inc. provides travel and restaurant online reservation and related services worldwide. The company operates Booking.com, which offers online accommodation reservations; Rentalcars.com that provides online rental car reservation services; Priceline, which offer online travel reservation services, including hotel, rental car and airline ticket reservation services, as well as vacation packages and cruises; and Agoda that provides online accommodation reservation services, as well as flight, ground transportation and activities reservation services. It also operates KAYAK, an online price comparison service that allows consumers to search and compare travel itineraries and prices, comprising airline ticket, accommodation reservation, and rental car reservation information; and OpenTable for booking online restaurant reservations. Further, it offers travel-related insurance products, and restaurant management services. The company was formerly known as The Priceline Group Inc. and changed its name to Booking Holdings Inc. in February 2018. Booking Holdings Inc. was founded in 1997 and is headquartered in Norwalk, Connecticut.",Norwalk,203-299-8000,CT,United States,[],https://www.bookingholdings.com,1.0,800 Connecticut Avenue,Travel Services,0.22017999,0.04145,0.74974996,1964000000,0.771,0.17276,2028999936.0,1890.0,buy,4852000000.0,2417874944,2700.5,2458.98,-0.046,2.483,0.04375,28.0,2715.11,208.007,0.07305,3160.0,12165000192.0,11534000128.0,9214999552.0,296.249,USD,224.697,2.374,2.4,NMS,Booking Holdings Inc. Common St,Booking Holdings Inc.,America/New_York,EST,False,-18000000,EQUITY,BKNG,finmb_33254,us_market,,10.787,,48.992,0.116150975,,99.87,,41063500.0,,,,135.035,510012.0,0.0124,,1609372800.0,0.92459,382000000.0,9.25,,0.22741783,18.209946,0.0023999999,1672444800.0,,1632960000.0,1.38,1638230400.0,40934546.0,1.244298,99403759616.0,2.0,,1055721600,1:6,,,,-0.04,10.957604,1640908800.0,0.27,,24.621807,,0.0125,497548.0,,,,2436.1,2442.84,2320.7727,,0.0,,2495.0,,277510.0,2436.1,2345.5703,,2442.84,,277510.0,,,,,,,2441.77,USD,265.83566,252284.0,,,,100974321664.0,,,346812.0,2441.77,2457.45,1000.0,252284.0,2687.29,,,1860.73,2456.01,False,,4000.0,2495.0,2458.98,,https://logo.clearbit.com/bookingholdings.com,0.6723900024468321,15.047554238831928,13.31042916034788,-7.448455692052757,BKNG,,,,,,,0.00643,USD-USD,USD-USD,1,0.157440647482872,0.03625684604048729,0.12832258641719818,1.1398608684539795,1.0,1.0
32,02139,Healthcare,1300.0,"Moderna, Inc., a biotechnology company, develops therapeutics and vaccines based on messenger RNA for the treatment of infectious diseases, immuno-oncology, rare diseases, cardiovascular diseases, and auto-immune diseases. As of March 9, 2021, the company had 13 programs in clinical trials and a total of 24 development programs in six modalities comprising prophylactic vaccines, cancer vaccines, intratumoral immuno-oncology, localized regenerative therapeutics, systemic secreted and cell surface therapeutics, and systemic intracellular therapeutics. The company has strategic alliances with AstraZeneca PLC, Merck & Co., Inc., Vertex Pharmaceuticals Incorporated, Vertex Pharmaceuticals (Europe) Limited, the Biomedical Advanced Research and Development Authority, the Defense Advanced Research Projects Agency, the National Institute of Allergy and Infectious Diseases, the National Institutes of Health, the Coalition for Epidemic Preparedness Innovations, Metagenomi, Inc., and Bill & Melinda Gates Foundation. Moderna, Inc. also has collaborations with Lonza Ltd.; Catalent Inc., Laboratorios FarmacÃ©uticos Rovi, S.A., Recipharm, and Lonza Group; Aldevron, LLC; Institute for Life Changing Medicines; and AbCellera Biologics Inc. The company was formerly known as Moderna Therapeutics, Inc. and changed its name to Moderna, Inc. in August 2018. Moderna, Inc. was founded in 2010 and is headquartered in Cambridge, Massachusetts.",Cambridge,617 714 6500,MA,United States,[],https://www.modernatx.com,1.0,200 Technology Square,Biotechnology,0.65691,0.5968,0.68091005,11573970944,30.65,0.64328,7772106752.0,86.0,hold,-574877000.0,8944045056,300.0,204.73,,1.348,0.372,16.0,284.14,5.758,1.09609,506.0,8906000384.0,583000000.0,11831395328.0,21.966,USD,29.517,1.216,2.6,NMS,"Moderna, Inc.","Moderna, Inc.",America/New_York,EST,False,-18000000,EQUITY,MRNA,finmb_128680956,us_market,,6.312,,9.609,0.637709,,27.86,,405449984.0,,,,24.998,16688182.0,0.041199997,,1609372800.0,0.61161,7060936192.0,16.692,,0.22741783,8.189856,0.09488,1672444800.0,,1632960000.0,1.41,1638230400.0,367479179.0,1.213908,74684678144.0,2.0,,,,,,,,7.0158906,1640908800.0,0.46,,7.348528,,0.0561,15287229.0,,,,210.17,204.01,278.24136,,0.0,,212.745,,9269620.0,210.17,259.6104,,204.01,,9269620.0,,,,,,,200.08,USD,12.265157,10167546.0,,,,83007774720.0,,,11602674.0,200.08,0.0,1000.0,10167546.0,497.49,,,117.341,0.0,False,,800.0,212.745,204.73,199.67,https://logo.clearbit.com/modernatx.com,-4.26915031177203,-27.72875013775894,63.770892111843345,-57.74145040731364,MRNA,617 583 1998,,,,,,0.00643,USD-USD,USD-USD,1,0.157440647482872,0.03625684604048729,0.12832258641719818,1.1398608684539795,1.0,1.0
33,01887,Technology,24700.0,"Analog Devices, Inc. designs, manufactures, tests, and markets integrated circuits (ICs), software, and subsystems that leverage analog, mixed-signal, and digital signal processing technologies. The company provides data converter products, which translate real-world analog signals into digital data, as well as translates digital data into analog signals; power management and reference products for power conversion, driver monitoring, sequencing, and energy management applications in the automotive, communications, industrial, and high-end consumer markets; and power ICs include performance, integration, and software design simulation tools for accurate power supply designs. It also offers high-performance amplifiers to condition analog signals; and radio frequency and microwave ICs to support cellular infrastructure; and microelectromechanical systems technology solutions, including accelerometers used to sense acceleration, gyroscopes for sense rotation, inertial measurement units to sense multiple degrees of freedom, and broadband switches for radio and instrument systems, as well as isolators. In addition, the company offers digital signal processing and system products for high-speed numeric calculations. It serves clients in the industrial, automotive, consumer, instrumentation, aerospace, and communications markets through a direct sales force, third-party distributors, and independent sales representatives in the United States, the rest of North and South America, Europe, Japan, China, and rest of Asia, as well as through its Website. Analog Devices, Inc. was incorporated in 1965 and is headquartered in Wilmington, Massachusetts.",Wilmington,781 935 5565,MA,United States,[],https://www.analog.com,1.0,One Analog Way,Semiconductors,0.38916,0.18999,0.61831003,2735068928,0.533,0.24232,2848005888.0,180.0,buy,4525012000.0,1119481856,210.0,172.0,-0.855,1.941,0.03004,25.0,207.56,18.736,0.055630002,220.0,1977964032.0,7118233088.0,7318285824.0,3.765,USD,18.413,1.241,1.9,NMS,"Analog Devices, Inc.","Analog Devices, Inc.",America/New_York,EST,False,-18000000,EQUITY,ADI,finmb_251411,us_market,,13.049,,33.531,0.07138407,,8.52,,525331008.0,,,,72.321,6625400.0,0.0126,,1635552000.0,0.88351995,1390422016.0,3.46,0.69,0.22741783,2.3782856,0.0021,1698624000.0,,1635552000.0,1.94,1638230400.0,523150550.0,1.10593,95497142272.0,2.0,,953164800,2:1,,1638403200,,-0.804,12.346735,1640908800.0,1.54,,20.187792,,0.0126,7408278.0,,,,169.78,168.415,168.68166,0.016256332,0.7775,,172.12,,3916730.0,169.78,178.8114,2.76,168.415,,3916730.0,,,2.76,1638403200,,,168.0917,USD,49.710983,2869639.0,,,,90356932608.0,,,3300046.0,168.0917,0.0,800.0,2869639.0,191.95,,1.92,142.25,0.0,False,0.016,900.0,172.12,172.0,170.31,https://logo.clearbit.com/analog.com,1.8715966184845279,-4.194284426277861,8.924464605563331,-8.549376208168969,ADI,,,,,,,0.00615,USD-USD,USD-USD,1,0.157440647482872,0.03625684604048729,0.12832258641719818,1.1398608684539795,1.0,1.0
