8,95110-2704,Technology,,"Adobe Inc. operates as a diversified software company worldwide. Its Digital Media segment provides tools and solutions that enable individuals, teams, and enterprises to create, publish, promote, and monetize their digital content. Its flagship product is Creative Cloud, a subscription service that allows customer to download and access the latest versions of its creative products. This segment serves content creators, experience designers, app developers, enthusiasts, students, social media users, and creative professionals; and marketing departments and agencies, companies, and publishers. The company's Digital Experience segment offers products, services, and solutions for creating, managing, executing, measuring, monetizing, and optimizing customer experiences from analytics to commerce. This segment serves marketers, advertisers, agencies, publishers, merchandisers, merchants, web analysts, data scientists, developers, marketing executives, information management and technology executives, product development executives, and sales and support executives. Its Publishing and Advertising segment offers products and services, such as e-learning solutions, technical document publishing, web conferencing, document and forms platform, web application development, and high-end printing, as well as publishing needs of technical and business, and original equipment manufacturers (OEMs) printing businesses. The company offers its products and services directly to enterprise customers through its sales force and local field offices, as well as to end users through app stores and through its website at adobe.com. It also distributes products and services through a network of distributors, value-added resellers, systems integrators, software vendors and developers, retailers, and OEMs. The company was formerly known as Adobe Systems Incorporated and changed its name to Adobe Inc. in October 2018. The company was founded in 1982 and is headquartered in San Jose, California.",San Jose,408 536 6000,CA,United States,[],https://www.adobe.com,1.0,345 Park Avenue,Software—Infrastructure,0.41681,0.30548,0.88185,,0.2,0.36756,6579333120.0,560.0,buy,13920000000.0,,680.0,525.83,-0.445,1.248,0.14076,28.0,671.75,31.581,0.34368,750.0,5798000128.0,4672999936.0,15784999936.0,12.181,USD,33.092,1.107,1.8,NMS,Adobe Inc.,Adobe Inc.,America/New_York,EST,False,-18000000,EQUITY,ADBE,finmb_24321,us_market,,15.785,,37.872,0.08279443,,16.25,,475800000.0,,,,31.086,4795281,0.0101,,1638489600.0,0.85199,4822000128.0,10.02,0.0065,0.230412,16.915333,0.00312,1701561600.0,,1638489600.0,1.59,1636934400,474619600.0,1.003041,249170083840.0,2.0,,1116892800,2:1,,1111622400,,-0.452,15.849853,1639526400,2.62,,32.35877,,0.0101,4143342,,,,510.7,500.0,586.4927,,0.0,,526.58,,3183920.0,510.7,623.3654,,500.0,,3183920.0,,,,1111622400,,,497.01,USD,52.478043,5187646.0,,,,250189922304.0,,,2848651.0,497.01,0.0,1200.0,5187646.0,699.54,,,420.78,0.0,False,,800.0,526.58,525.83,,https://logo.clearbit.com/adobe.com,-6.82884957754375,-20.123040127533166,10.878464051496861,-23.61229849939539,ADBE,,,,,,408 537 6000,0.0,USD-USD,USD-USD,1,0.1569390594959259,0.03613630682229996,0.1282610446214676,1.1349449157714844,1.0,1.0
9,23230,Consumer Defensive,7100.0,"Altria Group, Inc., through its subsidiaries, manufactures and sells cigarettes, oral tobacco products, and wine in the United States. It offers cigarettes primarily under the Marlboro brand; cigars principally under the Black & Mild brand; and moist smokeless tobacco products under the Copenhagen, Skoal, Red Seal, and Husky brands, as well as provides on! oral nicotine pouches. The company also produces and sells varietal and blended table wines, and sparkling wines under the Chateau Ste. Michelle and 14 Hands names; and imports and markets Antinori, Torres, and Villa Maria Estate wines, as well as Champagne Nicolas Feuillatte in the United States. In addition, it provides finance leasing services primarily in transportation, power generation, real estate, and manufacturing equipment industries. The company sells its tobacco products primarily to wholesalers, including distributors; and large retail organizations, such as chain stores. Altria Group, Inc. was founded in 1822 and is headquartered in Richmond, Virginia.",Richmond,804 274 2200,VA,United States,[],https://www.altria.com,1.0,6601 West Broad Street,Tobacco,0.5759,0.13164,0.65674,8282999808,-0.026,0.56380004,12140000256.0,45.0,buy,13488000000.0,6223374848,54.0,50.54,,0.742,0.17232001,17.0,53.61,,2.7119799,68.0,2956999936.0,28127000576.0,21080000512.0,1.61,USD,11.387,0.369,2.4,NYQ,"Altria Group, Inc.","Altria Group, Inc.",America/New_York,EST,True,-18000000,EQUITY,MO,finmb_53839346,us_market,,5.435,,9.437,,,4.83,,1836989952.0,,,,-0.689,11017436,0.006,,1609372800.0,0.60076,2764999936.0,1.494,,,,0.00098,1672444800.0,,1632960000.0,1.44,1636934400,1835225313.0,0.683636,114562138112.0,2.0,,860716800,3:1,,,,,4.4042444,1639526400,2.06,,10.463768,,0.006,11084010,,,,49.77,50.09,47.85445,0.06992164,2.3356,,50.66,,7837620.0,49.77,45.5118,3.48,50.09,,7837620.0,,,3.6,1640131200,,,49.96,USD,33.828648,12438295.0,,,,92841476096.0,,,8071338.0,49.96,0.0,1200.0,12438295.0,52.59,,6.09,40.46,0.0,False,0.0734,900.0,50.66,50.54,,https://logo.clearbit.com/altria.com,5.357514341098346,13.559241696005554,31.31834769578625,0.0,MO,,,,eb0459bf-ce41-3588-8ecf-61fb07987581,,,0.0,USD-USD,USD-USD,1,0.1569390594959259,0.03613630682229996,0.1282610446214676,1.1349449157714844,1.0,1.0
10,94903,Technology,11500.0,"Autodesk, Inc. provides 3D design, engineering, and entertainment software and services worldwide. The company offers AutoCAD Civil 3D, a surveying, design, analysis, and documentation solution for civil engineering, including land development, transportation, and environmental projects; BIM 360, a construction management cloud-based software; AutoCAD, a software for professional design, drafting, detailing, and visualization; AutoCAD LT, a drafting and detailing software; computer-aided manufacturing (CAM) software for computer numeric control machining, inspection, and modelling for manufacturing; Fusion 360, a 3D CAD, CAM, and computer-aided engineering tool; and Industry Collections tools for professionals in architecture, engineering and construction, product design and manufacturing, and media and entertainment collection industries. It also provides Inventor tools for 3D mechanical design, simulation, analysis, tooling, visualization, and documentation; Vault, a data management software to manage data in one central location, accelerate design processes, and streamline internal/external collaboration; Maya and 3ds Max software products that offer 3D modeling, animation, effects, rendering, and compositing solutions; and Shotgun, a cloud-based software for review and production tracking in the media and entertainment industry. In addition, the company offers PlanGrid, a cloud-based field collaboration software, which provides general contractors, subcontractors, owners, and architects access to construction information in real-time; Revit software for building information modeling; and BuildingConnected, a bid-management solution. Autodesk, Inc. sells its products and services to customers directly, as well as through a network of resellers and distributors. The company was founded in 1982 and is headquartered in San Rafael, California.",San Rafael,415 507 5000,CA,United States,[],https://www.autodesk.com,1.0,111 McInnis Parkway,Software—Application,0.18621,0.31305,0.91737,1466099968,0.182,0.16372,784700032.0,250.0,buy,3484900000.0,1292612480,340.0,262.39,0.034,0.809,0.05957,21.0,329.81,238.261,1.9555299,440.0,1792099968.0,3049499904.0,4214000128.0,8.147,USD,19.181,0.723,2.1,NMS,"Autodesk, Inc.","Autodesk, Inc.",America/New_York,EST,False,-18000000,EQUITY,ADSK,finmb_119902,us_market,,14.82,,79.587,,,6.83,,219972992.0,,,,5.812,2811456,0.0128,,1612051200.0,0.92739,1319200000.0,5.928,,,45.14625,0.00187,1675123200.0,,1635638400.0,1.23,1636934400,219652256.0,1.408008,62451806208.0,2.0,,1103587200,2:1,,,,0.034,13.696896,1639526400,1.92,,38.41728,,0.0128,2405491,,,,262.32,256.54,293.27036,,0.0,,262.73,,1007500.0,262.32,289.6642,,256.54,,1007500.0,,,,1111449600,,,250.65,USD,44.262825,1637452.0,,,,57718718464.0,,,1502067.0,250.65,0.0,800.0,1637452.0,344.39,,,245.05,0.0,False,,1800.0,262.73,262.39,,https://logo.clearbit.com/autodesk.com,-7.517970703684451,-2.41371248010932,-17.43808669830741,-23.338293431868372,ADSK,,,,,,415 507 5100,0.0,USD-USD,USD-USD,1,0.1569390594959259,0.03613630682229996,0.1282610446214676,1.1349449157714844,1.0,1.0
11,5504 DR,Technology,29025.0,"ASML Holding N.V. develops, produces, markets, sells, and services advanced semiconductor equipment systems consisting of lithography, metrology, and inspection related systems for memory and logic chipmakers. The company provides extreme ultraviolet lithography systems; and deep ultraviolet lithography systems comprising immersion and dry lithography solutions to manufacture various range of semiconductor nodes and technologies. It also offers metrology and inspection systems, including YieldStar optical metrology solutions to measure the quality of patterns on the wafers; and HMI e-beam solutions to locate and analyze individual chip defects. In addition, the company provides computational lithography and software solutions to create applications that enhance the setup of the lithography system; and mature products and services that refurbish used lithography equipment and offers associated services. It operates in Japan, South Korea, Singapore, Taiwan, China, the Netherlands, Europe, the Middle East, Africa, the United States, and rest of Asia. The company was formerly known as ASM Lithography Holding N.V. and changed its name to ASML Holding N.V. in 2001. ASML Holding N.V. was founded in 1984 and is headquartered in Veldhoven, the Netherlands.",Veldhoven,31 480 235 0934,,Netherlands,[],https://www.asml.com,1.0,De Run 6501,Semiconductor Equipment & Materials,0.36928,0.3054,0.52124,9099200512,0.324,0.34834,6602599936.0,720.0,buy,6797200000.0,6561762304,879.76,727.17,0.684,1.711,0.14755,8.0,868.69,35.695,0.43258998,1030.0,4455699968.0,4105799936.0,17879599104.0,10.924,EUR,43.31,1.046,2.0,NMS,ASML Holding N.V. - New York Re,ASML Holding N.V.,America/New_York,EST,False,-18000000,EQUITY,ASML,finmb_388904,us_market,,17.23,,46.658,0.47121203,,19.65,,406473984.0,,,,28.199,1115542,0.0027,,1609372800.0,0.18656999,5460400128.0,15.0,2.094,0.230412,25.787085,0.0,1672444800.0,,1633219200.0,1.23,1636934400,407802104.0,0.946873,308063305728.0,2.0,,1191196800,8:9,,1635811200,,0.639,16.531448,1639526400,1.61,,37.138405,,,775738,,,,756.1,716.5184,744.96716,0.0044306307,0.2074,,727.66,,832160.0,756.1,804.0052,3.35,716.5184,,832160.0,,,3.96,1635811200,,,702.3,USD,48.42312,1973435.0,,,,295575683072.0,,,873982.0,702.3,0.0,800.0,1973435.0,895.93,,0.82,501.11,0.0,False,0.005,900.0,727.66,727.17,,https://logo.clearbit.com/asml.com,-8.817666451656947,-4.879195942603465,43.94889975135068,-18.021356367262463,ASML,,,,2ba52262-559d-3b17-bb19-4711bad6d978,,,0.0,EUR-USD,USD-USD,1,0.1569390594959259,0.03613630682229996,0.1282610446214676,1.1349449157714844,1.1349449157714844,1.0
12,68131,Financial Services,360000.0,"Berkshire Hathaway Inc., through its subsidiaries, engages in the insurance, freight rail transportation, and utility businesses worldwide. It provides property, casualty, life, accident, and health insurance and reinsurance; and operates railroad systems in North America. The company also generates, transmits, stores, and distributes electricity from natural gas, coal, wind, solar, hydro, nuclear, and geothermal sources; operates natural gas distribution and storage facilities, interstate pipelines, liquefied natural gas facilities, and compressor and meter stations; and holds interest in coal mining assets. In addition, the company manufactures boxed chocolates and other confectionery products; specialty chemicals, metal cutting tools, and components for aerospace and power generation applications; and flooring, insulation, roofing and engineered, building and engineered components, paints and coatings, and bricks and masonry products, as well as offers manufactured and site-built home construction, and related lending and financial services; and recreational vehicles, apparel products, jewelry, and custom picture framing products, and alkaline batteries. Further, it manufactures castings, forgings, fasteners/fastener systems, and aerostructures; and seamless pipes, fittings, downhole casing and tubing, and various mill forms. Additionally, the company distributes televisions and information; franchises and services quick service restaurants; distributes electronic components; and offers logistics services, grocery and foodservice distribution services, and professional aviation training and shared aircraft ownership programs. It also retails automobiles; furniture, bedding, and accessories; household appliances, electronics, and computers; jewelry, watches, crystal, china, stemware, flatware, gifts, and collectibles; kitchenware; and motorcycle apparel and equipment. The company was incorporated in 1998 and is headquartered in Omaha, Nebraska.",Omaha,402-346-1400,NE,United States,[],https://www.berkshirehathaway.com,1.0,3555 Farnam Street,Insurance—Diversified,0.45458,0.32002997,0.41395,42171998208,0.12,0.41395,122136002560.0,327.0,hold,69721000000.0,70070501376,337.0,318.93,-0.638,1.608,0.07941,2.0,337.0,23.898,0.19336,347.0,149197996032.0,114964996096.0,268677005312.0,100205.05,USD,175827.33,1.446,2.8,NYQ,Berkshire Hathaway Inc. New,Berkshire Hathaway Inc.,America/New_York,EST,True,-18000000,EQUITY,BRK-B,finmb_255251,us_market,,-0.094,,-0.206,0.37226963,,12.76,,1303480064.0,,,,316350.56,8574231,0.0038,,1609372800.0,0.66767997,85984002048.0,56269.562,,0.230412,0.0010081537,0.00187,1672444800.0,,1632960000.0,1.75,1636934400,1224538.0,0.901298,-25161871360.0,2.0,,1264032000,50:1,,,,-0.657,2.6581,1639526400,1.17,,24.994513,,0.0074,9100315,2233380096,,,319.78,321.4,282.45566,,0.0,,322.1,,4051700.0,319.78,290.0886,,321.4,,4051700.0,,,,,,,315.12,USD,0.0056678955,5502647.0,,,,714170302464.0,,,4275758.0,315.12,0.0,1300.0,5502647.0,322.1,,,226.1,0.0,False,,900.0,322.1,318.93,,https://logo.clearbit.com/berkshirehathaway.com,6.030780150780912,9.972063699983424,36.627683966367506,-0.26580965249870525,BRK-B,,,,61ab9da0-8314-31b8-8597-7a8f2ac52909,,,0.0,USD-USD,USD-USD,1,0.1569390594959259,0.03613630682229996,0.1282610446214676,1.1349449157714844,1.0,1.0
13,10282,Financial Services,43000.0,"The Goldman Sachs Group, Inc., a financial institution, provides range of financial services for corporations, financial institutions, governments, and individuals worldwide. It operates through four segments: Investment Banking, Global Markets, Asset Management, and Consumer & Wealth Management. The company's Investment Banking segment provides financial advisory services, including strategic advisory assignments related to mergers and acquisitions, divestitures, corporate defense activities, restructurings, and spin-offs; and middle-market lending, relationship lending, and acquisition financing, as well as transaction banking services. This segment also offers underwriting services, such as equity underwriting for common and preferred stock and convertible and exchangeable securities; and debt underwriting for various types of debt instruments, including investment-grade and high-yield debt, bank and bridge loans, and emerging- and growth-market debt, as well as originates structured securities. Its Global Markets segment is involved in client execution activities for cash and derivative instruments; credit and interest rate products; and provision of equity intermediation and equity financing, clearing, settlement, and custody services, as well as mortgages, currencies, commodities, and equities related products. The company's Asset Management segment manages assets across various asset classes, including equity, fixed income, hedge funds, credit funds, private equity, real estate, currencies, and commodities; and provides customized investment advisory solutions, as well as invests in corporate, real estate, and infrastructure entities. Its Consumer & Wealth Management segment offers wealth advisory and banking services, including financial planning, investment management, deposit taking, and lending; private banking; and unsecured loans, as well as accepts saving and time deposits. The company was founded in 1869 and is headquartered in New York, New York.",New York,212-902-1000,NY,United States,[],https://www.goldmansachs.com,1.0,200 West Street,Capital Markets,0.0,0.38197,0.89524,-7961999872,0.279,0.48047,,330.0,buy,35974000000.0,,460.0,399.17,0.662,1.721,0.017239999,27.0,459.62,533.961,0.21962999,598.0,937806987264.0,576117014528.0,58134999040.0,2679.325,USD,164.747,1.63,2.2,NYQ,"Goldman Sachs Group, Inc. (The)","The Goldman Sachs Group, Inc.",America/New_York,EST,True,-18000000,EQUITY,GS,finmb_398625,us_market,,-3.63,,,0.31534362,,40.58,,333577984.0,,,,275.256,4015707,0.012,,1609372800.0,0.73353994,21674999808.0,60.63,2,0.230412,1.4501773,0.00521,1672444800.0,,1632960000.0,1.62,1636934400,348318620.0,1.511168,-211004063744.0,2.0,,,,,1638316800,,0.597,2.2904332,1639526400,0.37,,9.919731,,0.0121,3964231,,,,397.51,401.32,380.9114,0.014465044,0.094799995,,404.37,,2308830.0,397.51,395.3464,5.75,401.32,,2308830.0,,,8,1638316800,,,394.215,USD,6.5837045,2980150.0,,,,133154324480.0,,,2550248.0,394.215,0.0,1100.0,2980150.0,426.16,,1.62,270.62,0.0,False,0.0196,900.0,404.37,399.17,,https://logo.clearbit.com/goldmansachs.com,0.9713472253304101,3.7775577750477574,38.23551077111196,-5.325819524996289,GS,,,,71a75a16-7c33-358b-bb56-1764255c880a,29th Floor,,0.0,USD-USD,USD-USD,1,0.1569390594959259,0.03613630682229996,0.1282610446214676,1.1349449157714844,1.0,1.0
14,94086-5304,Healthcare,8081.0,"Intuitive Surgical, Inc., together with its subsidiaries, designs, develops, manufactures, and markets da Vinci surgical systems, and related instruments and accessories in the United States and internationally. The company's da Vinci Surgical System include surgeon's consoles, patient-side carts, 3-D HD vision systems, skills simulators, da Vinci Xi integrated table motions, and Firefly fluorescence imaging products that enable surgeons to perform various surgical procedures, including gynecologic, urologic, general, cardiothoracic, and head and neck surgical procedures. It also manufactures EndoWrist instruments, such as forceps, scissors, electrocautery tools, scalpels, and other surgical tools, which incorporate wrist joints for natural dexterity for various surgical procedures; and provides SimNow, a cloud-enabled simulation platform, which allows surgeons to learn and practice their surgical skills; Iris, an augmented reality imaging product for use in kidney procedures; and Intuitive Cloud that enables proactive monitoring and software updates. In addition, the company offers EndoWrist Stapler, a wristed stapling instrument for resection, transection, and creation of anastomoses; EndoWrist One Vessel Sealers that are wristed single-use instruments for bipolar coagulation and mechanical transection of vessels up to 7mm in diameter and tissue bundles that fit in the jaws of the instrument; E-100 generator, an electrosurgical generator; SureForm 45 Curved-Tip stapler; and SynchroSeal for sealing and transection with a single pedal press. Additionally, the company sells various accessories comprising sterile drapes for ensuring sterile field during surgery; and vision products that include replacement 3D stereo endoscopes, camera heads, light guides, and other items that facilitate the use of the da Vinci Surgical System, as well as Ion endoluminal system for biopsies. Intuitive Surgical, Inc. was founded in 1995 and is headquartered in Sunnyvale, California.",Sunnyvale,408 523 2100,CA,United States,[],https://www.intuitive.com,1.0,1020 Kifer Road,Medical Instruments & Supplies,0.38052,0.30777,0.69117,2149199872,0.302,0.32526,2088499968,289.67,buy,2861200000.0,1669049984,370.0,325.53,0.195,5.576,0.09475,14.0,358.86,,0.16475001,425.0,4132000000.0,0.0,5488500224.0,11.567,USD,15.468,4.795,2.2,NMS,"Intuitive Surgical, Inc.","Intuitive Surgical, Inc.",America/New_York,EST,True,-18000000,EQUITY,ISRG,finmb_30239,us_market,,22.338,,58.704,,,5.57,,357236992.0,,,,31.945,2720374,0.0076,,1609372800.0,0.86388,1689200000.0,4.638,,,10.190328,0.00963,1672444800.0,,1632960000.0,1.6,1636934400,353864545.0,1.087792,122603511808.0,2.0,,1507248000,3:1,,,,0.212,21.188185,1639526400,4.15,,58.443443,,0.0076,2757792,,,,324.29,321.18,319.36786,,0.0,,325.8,,1301520.0,324.29,347.496,,321.18,,1301520.0,,,,,,,315.25,USD,70.187584,2057509.0,,,,116291354624.0,,,1573848.0,315.25,0.0,900.0,2057509.0,369.69,,,227.46666,0.0,False,,1100.0,325.8,325.53,,https://logo.clearbit.com/intuitive.com,-9.575000339084205,-4.357147493982739,20.025805571771095,-10.916209617053763,ISRG,,,,fae970d5-82c8-3b4b-a1eb-c4a07c93573d,,408 523 1390,0.0,USD-USD,USD-USD,1,0.1569390594959259,0.03613630682229996,0.1282610446214676,1.1349449157714844,1.0,1.0
15,30313,Consumer Defensive,80300.0,"The Coca-Cola Company, a beverage company, manufactures, markets, and sells various nonalcoholic beverages worldwide. The company provides sparkling soft drinks; water, enhanced water, and sports drinks; juice, dairy, and plantÂbased beverages; tea and coffee; and energy drinks. It also offers beverage concentrates and syrups, as well as fountain syrups to fountain retailers, such as restaurants and convenience stores. The company sells its products under the Coca-Cola, Diet Coke/Coca-Cola Light, Coca-Cola Zero Sugar, Fanta, Fresca, Schweppes, Sprite, Thums Up, Aquarius, Ciel, Dasani, glacÃ©au smartwater, glacÃ©au vitaminwater, Ice Dew, I LOHAS, Powerade, Topo Chico, AdeS, Del Valle, fairlife, innocent, Minute Maid, Minute Maid Pulpy, Simply, Ayataka, Costa, dogadan, FUZE TEA, Georgia, Gold Peak, HONEST TEA, and Kochakaden brands. It operates through a network of independent bottling partners, distributors, wholesalers, and retailers, as well as through bottling and distribution operators. The company was founded in 1886 and is headquartered in Atlanta, Georgia.",Atlanta,404 676 2121,GA,United States,[],https://www.coca-colacompany.com,1.0,One Coca-Cola Plaza,Beverages—Non-Alcoholic,0.35199,0.23313999,0.60723996,12855000064,0.161,0.31123,13306000384,55.0,buy,19581000000.0,7007374848,63.0,60.43,0.425,1.516,0.07831,25.0,62.88,172.826,0.39722002,67.6,14871000064.0,41707999232.0,37802000384.0,3.443,USD,8.771,1.173,2.1,NYQ,Coca-Cola Company (The),The Coca-Cola Company,America/New_York,EST,True,-18000000,EQUITY,KO,finmb_26642,us_market,,7.651,,21.735,,,2.43,,4319419904.0,,,,5.135,31079912,0.0072000003,,1609372800.0,0.69682,8812999680.0,2.031,,,11.768256,0.00636,1672444800.0,,1633046400.0,1.62,1636934400,3890717778.0,0.712113,289208860672.0,2.0,,1344816000,2:1,,,,0.423,6.904993,1639526400,2.72,,24.868313,,0.0073,30746708,,,,60.33,60.55,55.36445,0.027681086,0.82269996,,60.82,,14560560.0,60.33,56.7332,1.67,60.55,,14560560.0,,,1.68,1638230400,,,60.18,USD,29.753817,19571195.0,,,,261022547968.0,,,16623662.0,60.18,0.0,900.0,19571195.0,61.2,,3.21,48.11,0.0,False,0.0278,3000.0,60.82,60.43,,https://logo.clearbit.com/coca-colacompany.com,1.9055667498373507,4.622579745898614,24.173556504614258,-0.5922036600259473,KO,,,,5fed318f-9c85-3ad1-b311-20392472c25a,,,0.0,USD-USD,USD-USD,1,0.1569390594959259,0.03613630682229996,0.1282610446214676,1.1349449157714844,1.0,1.0
